star,promotion,welfare,worklife,culture,ceo,merit,disadvantage
4,4,4,4,4,3,"국내 모든 공항을 운영한다는 자부심, 사람들이 다 순하고 좋음,","언제 어디로 발령이 날지 모르는 부담감. 큰 공항이 아니라면 신입에게 업무가 쏠리는 현상, 규모대비 인원이 많지않아 소문이 빠른편,업무핑퐁의쓰나미"
4,4,4,4,4,4,공항 관련 업무를 해 직무만족도가 높습니다,공기업이다보니 정부정책에 따라 급여 및 복지가 변합니다
3,2,3,3,2,3,적당한 급여와 적당한 근무강도. 대외적인 이미지.,지방공항이 많아 지방발령을 피하기 어려움
4,3,4,4,4,4,"다양한 교육제도, 공항시설간의 접근성이 뛰어남",공기업 정상화로 인해 복지 부분에서 많은 부분이 축소됨
2,3,3,3,3,3,다양한 전문부서와 같이 일할수 있는 장점이 있다.,안정적인 생활로 인하여 직원들이 미래에 대한 걱정을 하지 않는다.
3,3,3,3,3,3,"고용안전성이 높으며, 지역에 따라 다르나 가족적인 분위기","다소 군대같은 조직문화, 부서에 따라 다르나 높은 업무강도"
3,5,3,2,4,4,항공산업에 관심이 많다면 항공 산업 전반에 대한 업무를 접해볼 수 있으며 보수도 나쁘지 않습니다.,"업무의 강도가 높으며, 보직이 순환되기에 어느 한 분야의 전문가가 되기에는 한계가 있으며 지방 근무를 해야됩니다."
4,3,4,4,3,3,메이저 공기업의 자부심과 복리후생등이 장점,"보수적인 사람이 많고, 입소문도 빨리 돌아 행동에 조심해야하고, 일보다는 사람들에게 시달리는 경우가 많음"
4,3,3,4,4,4,공항에서 일한다는 자부심을 느낄수있고 타공기업보단 업무 강도가 높지만 일반적인 대기업과 비교해선 업무강도는 낮은편입니다.,공기업 정상화로 인해 복리후생이 많이 축소되었고 앞으로도 더축소될예정입니다.
4,4,5,4,4,3,메이져공기업 다운 복지 연봉. 공항근무라는 특수성. 공항 전반을 경험할 수 있는 다양성. 서울근무 가능한 장점,엄청난 전문성을 기대하긴 어렵다. 국토부 눈치 많이봄.
3,2,3,3,3,3,"안정성, 분위기 좋음, 공기업 중에서는 연봉이 높은 편","임금체계 변화로 차장급 직원과 그 이하 직원간의 연봉격차가 큼
순환근무"
5,3,4,4,4,4,공기업 특유의 안정성과 직원을 배려하는 분위기를 느낄 수 있음.,"본사가 매우 바쁘다는 소식이 있음. 지방근무 발령가능, 간혹 야근이있음"
3,2,2,2,2,2,매우 안정적임 짤릴위험 거의없음 정말 무능한사람도 많음,40대 이하가 19퍼센트밖에 안되는 경직된 조직문화
3,2,4,4,3,3,공기업 중에서는 연봉 복지혜택 나쁘지 않음. 기술직은 비교적 근무면에서는 여유가있다,보수적인 기업문화. 그 이유는 다수의 공군 출신 장교 혹은 부사관들이 자리잡고있음 현ceo는 경찰출신 ;;
4,3,4,4,4,3,생각보다는 유연하지만 공기업특유의 보수적인 면도 있음. 근무지가 모두 공항근처라 문화생활은 별문제 없음,교대근무나 순환근무의 가능성이 있음. 부서에 따라서는 해외출장도 감
4,3,4,5,4,4,"다양한 직군이 존재하는 곳이고 많은 국민들이 이용하는 공항을 관리하는 곳인 만큼 강한 자부심을 갖고 일하게 됩니다.
또한 적지않은 급여와 적당한 자기시간을 갖음으로써 삶의 만족도를 높힐 수 있는 곳입니다.","아직까지 남아있는 기업의 보수적인 부분이 단점이라면 단점이지만 군대문화까지는 아니기에 큰 단점은 아닌 것 같습니다.
최근 정부의 공기업의 방만경영으로 인한 규제 때문에 복지부분이나 급여 부분이 많이 축소 되었습니다."
4,2,3,4,4,4,"가족같은 따뜻한 분위기. 물론 팀마다 차이가 있겠지만. 현 리더십은 직원의 가정생활을 보장하는 분위기로 흘러가고, 안정과 변혁 사이에서 기회를 잡을 수 있을지도 모른다. 금융부채 0%에 육박하는 초건전 재무구조. 앞으로도 최소 십수년간은 흑자경영이 보장된 상황이긴 하다.","행정을 위한 행정, 보여주기 위한 일 등 군대-공무원-공공기관을 관통하는 구태를 여전히 가지고 있다. 튀는 인재는 싫어하고 무리에서 융화할 수 있는 안정지향의 인재가 살아남게 되는 구조. 국토부의 인국공 편애 정책이 신성장동력 확보에 장애물로 기능하고 있으며 앞으로 얼마나 경쟁력을 확보할 수 있을지 불투명."
5,5,5,5,5,5,공기업이라는 특성때문에 정년보장과 경쟁이 적다,도전적인 모습이 부족하다 공기업의 전형적인 단점이라고 생각
3,3,3,2,2,2,공항에서 일한다는 자부심을 느낄 수 있음 공기업치고는 연봉이 낮지는 않은 수준,조직문화가 그닥 좋지 않음 팀마다 다르지만 팀에서 팀들간의 융화가 잘 되지 않음
4,5,4,4,3,2,안정적. 가족적인 분위기. 능력이 있다면 인정받아 자기성장할 수 있는 기회가 분명 존재함.,복지부동. 혁신에 소극적인 분위기. 보수적인 문화.
3,3,3,4,3,3,"공기업의 안정성을 느낄 수 있음, 가족같고 따뜻한 분위기","정부의 방침에 전직원 출동. 봉사활동, 길거리청소 등 보여주기식 활동."
2,3,3,2,2,2,"노조덕분인지 복지는 좋은편
항공에 관한 전문성을 기를 수 있음","보수적인 회사분위기
정부랑 이것저것 연관되어 있어 쓸데없이 바쁨
업무에 집중할 수 없는 상명하복 환경"
3,2,2,2,2,3,"안정적인 공기업. 공항관리, 운영이라는 조금은 특수한 업무를 해볼 수 있는 기회.",거주지와 별개로 전국 지방공항에서 근무 가능성 있음. 보수적인 문화가 아직 남아있음. 업무강도에 따라 퇴근 시간 상이함.
