star,promotion,welfare,worklife,culture,ceo,merit,disadvantage
1,3,2,1,2,1,CJ계열사 할인과 복지혜택이 좋음. 식품기업으로써 회사내부가 정말 깔끔하고 cj제품 식단이 많이나온다.,생산직은 3조3교대 근무로 3주에 하루쉼. 연차도 마음대로 못씀. 사원 400명중에 200명이 신입사원. 사람은 많이 뽑는데 그만큼 많이 그만둠. 다이아몬드 분포로 탄탄하지 못함. 현장사람들은 졸음운전 사고가 빈번하게 일어난다...일년중에 쉬는날이 한달이 안된다
4,3,4,3,1,4,신제품 개발 및 마케팅력 우수. 적절한 보상. 중간정도 업무 강도,경력들에게 비추함. 오로지 공채위주의 회사. 감사기능강함.
3,4,2,3,3,2,직원 복지가 나쁘진 않은것같다. 임직원 할인제도를 잘 이용하면 그나마 생활에 보탬이 될 수 있다,인프라나 직원 복지 연봉등은 아직 중견기업수준이지만 직원들에게 원하는 수준은 일류기업 수준을 원한다
1,1,1,1,1,1,"복지는 대기업 중에서 TOP 5안에 들정도로 좋은 회사
(1번쯤은 생각할만한 복지도 있는 그런 복지에서는 TOP OF TOP인 회사)

팀장이건 과장이건 공장장이건 사원에게 000님이라고 존댓말을 해주면서 수직관계가 아닌 수평관계인 회사 (단 사무직 기준)","복지이외에는 모든것이 열악한 회사.
협력업체와 임금차이가 거의 없는 초봉
(격차 벌릴라면 3~4년은 있어야 그나마 벌어짐)

육가공 공장에서 일했으나 기숙사에서 거주한다는 이유로 일-잠 , 일-잠 무한반복에 굴레에 빠지는 회사.

반년도 안된 신입사원에게 1~2년 경력직에 업무를 요구하는 회사 등등 이루 말할수 없을정도로 많음

가장 중요한 생산물량에 압박 !!!

사람인지 노예인지 구분이 안갈정도에 업무량 !!"
4,5,3,2,3,4,"복지카드, 성과에따른 차등보상 해외투자가 계속증가하여 해외에나갈기회가증가함 이직시 회사브랜드로도움이됨",성과위주다보니 업무강도가높음 성과에따라고용안정성이낮다 업무가많다보니 휴가쓸때눈치가많이보임
4,4,4,3,3,4,"1. 그룹사 할인 혜택이 좋음.
특히, 그룹 내에 외식계열 프랜차이즈나 영화사, 드럭스토어까지 있어서 어지간한 할인시즌과 겹쳐서 사용하면 원가 대비 60% 이상 할인된 가격으로 소비 가능.

2. 성과제일주의.
성과를 내는 만큼 자신의 커리어를 만들기 좋음.
또한, 업무 실적이 승진에 큰 영향을 미쳐서 40대 초반에 부장을 달고 임원까지 노릴 수 있음. 따라서 야망과 노력의 의지가 받쳐준다면 딱 맞는 회사임.

3. 식품업계 부동의 1위 기업.
식품업계의 삼성전자라는 말이 당연할 정도로 다루는 품목도 많고 타사 대비 담당 업무가 분업화되어 있음.
특히, 지역 단위 섹터 담당이 아니라 할인점, SSM 등을 회사별로 맡는 등 담당 영업채널 기준으로 업무를 분화하기 때문에 업무에 혼선이 생기지 않음.

4. 수평적 조직문화.
일부를 제외하면 대체적으로 '~님' 호칭을 사용함. 물론, 부서장 이상의 상급자나 비슷한 직급의 선후배 간에는 융통성 있게 호칭을 사용하기도 함.
완벽하게 시행되진 않아도 타사와 달리 이러한 방식으로 조직문화를 유연하게 하려는 건 좋은 시도라고 생각함.

5. 성장성.
현재 제일제당은 식품업계 부동의 1위를 지키면서 해외사업 확대도 적극적임. 능력과 기회가 된다면 해외 법인으로도 나갈 수 있음.
식품부문 외에도 사료 판매 및 컨설팅을 담당하는 생물자원 부문이나 바이오 사업 부문도 세계적으로도 손꼽히는 수준임.(16년 결산 매출 13조 5천억, 당기순이익 약 5,600억 원, 국내외 투자 1조 7천억 원.)","1. 성수철 영업.
성수철에는 총력전이라 할 정도로 치열하게 영업을 해야 함. 이 시기가 되면 본사 스탭 부서에서 근무하는 직원들도 최소한을 남기고 현장지원에 투입되고, 연수 중인 신입사원들도 명절 며칠 전부터 고향 근처에 있는 지점에서 현장 지원을 나감.
특히, 선물세트 물량 확보는 각 지역사업단이나 지점 단위로 치열함.
게다가, 사업 포트폴리오 특성상 경쟁사와 달리 늦봄에서 초여름에 이르는 설탕 시즌 영업까지 해야 하기 때문에 업무 강도가 올라감.

2. 과중한 업무 부담.
그룹 내부 목표를 맞추기 위해 실적 압박이 심함.
또한, 과자류를 제외한 거의 모든 식료품을 다루기 때문에 1인당 업무부담이 타사에 비해 많음.
그나마 몇 년 전에 영업조직 개편을 하면서 지점의 부담이 줄어들었다고는 하지만 성수철만 되면 야근이 다반사임.
이 때문에 대우는 업계 최고라고 하지만 사실상 업무 대비 보수가 적은 편이라는 생각이 듦."
3,2,3,4,4,4,연차를 눈치 안보고 쓸 수있음 영업팀는 자유로운 편 복지카드 나옴 임직원 할인혜택 좋음,승진이 어렵다 연봉이 적다 기회 평등하지 않고 경력직으로 온 사람 중에 이상한 사람 많음
4,5,3,4,5,3,"연차를 내거나, 생리 휴가, 출산 휴가등도 눈치 안보면서 쓸 수 있는 기업문화. 지리적 위치도 좋고, 지하 푸드 코트 할인 받을 수 있음. 다양한 먹거리가 있기 때문에 무엇을 먹을지 항상 고민함. 대부분30~50프로 할인 받을 수 있음","솔직히 인턴이라 정시 출근 정시 퇴근을 하여서 잘모르겟지만, 부서마다 야근하는 부서도 있고 부서에 따라 크게 다른 것 같음. 예를 들어 신제품 기획 파트는 야근이 잦음."
3,3,4,3,5,3,안정적인 연봉. 사내 분위기. 좋은 혜택. 대기업 다닌다는 자존감.,직급은 없다고 하지만 다 있다. 또한 팀내별로 분위기가 많이 다르다.
4,4,4,3,3,3,"대기업 이다보니 식품업계에서는 위생에 아주 많이 신경을 쓰고있는것 같다.
CJ복지카드의 혜택이 아주 좋다.
지방근무자의 경우 기숙사를 제공하고 있다.
식품업계에서는 자부심을 느끼면서 다닐 수 있다.",연봉이 아주 낮으며 대기업이기 때문에 직급체계와 인사평가에 따른 승진으로 인해서 빠른 승진은 아주 힘들다. 또한 생산직의 경우 낮은연봉으로 인한 퇴사율이 높기때문에 나머지 인원이 조금 힘들 수 있다.
2,2,2,1,2,5,복지가 확실히 좋다 다양한계열사에서 다양한 복지해택을 누릴수있다. 임직원카드 굳,"그복지들이 돈을써야 해택을누릴수있게 아주 잘만들어놧다.
그리고 생산직같은경우 식품 회사다보니 깨끗함을위해 내온몸에 방진복을 입는경우도......이런점들과 3교대 근무와 줄타기 좋아하는분들 입사 추천"
3,3,3,3,3,3,"씨제이의 복지를 누릴 수 있음
님 호칭으로 평등화를 추구하는 기업 가치관이 보여짐","연봉이 높지 않음
대기업이라고 하기에 약간 애매한 점이 종종보임"
5,4,5,2,3,3,"인지도 , 임직원 할인혜택 , 비교적 깨끗함 공장
그 밖에 대기업 다운 복지제도
소문과 달리 수당을 더하면 연봉도 양호한 편","지리적으로 시골에 위치함
생산품 특성상 냄새가 나는편
부서 별로 근무 차이가 매우 큼"
3,2,3,2,3,2,다른 한국의 대기업 대비 비교적 수평적인 문화이나 팀장급 이하에 해당되는 얘기임. 다른 회사에 가면 보고서 좀 쓴다는 평가를 받게됨.,"단순보고를 위한 문서작업이 지나치게 많고, 유연한 문화를 내세우나 업무처리는 매우 보수적이고 유연하지 않음."
2,2,3,1,2,2,"임직원 혜택 35프로의 자부심
이외에도 Cj의 영향력덕분에 실제혜택이 많음","지나친 성과제, 3조 3교대임에도 턱없이 낮은 연봉, 상여금이 없는 점, 지나친 회식 및 동아리장려"
3,4,4,3,3,3,"도서구입비, 학원비 등 자기계발 비용 지원,
회사 연계 국내 및 해외 호텔/펜션 포인트 지원하여 저렴하게 이용 가능
수평적인 기업문화","보고를 위한 보고자료 작성 업무가 많음
회식문화가 발달함
업무강도에 비해 급여가 많지 않음"
1,2,1,1,2,1,국내1위식품회사.높은인지도. 계열사할인(올리브영.시지브이등등),중소기업연봉. 대외이미지와전혀다른보수적인문화. 야근야근야근.주말출근 무한궤도
3,4,4,1,3,3,"1.대기업답게 각종 복지는 좋은편이다. 35프로 할인카드와 간간히 나오는 영화예매권, 생일 빵쿠폰... 호텔 지원 등..
2.이미지가 참 좋아서 타인에게 높은 평가른 받을수 있다.","전형적인 대기업 분위기.. 그 이상 이하도 아님...
생각보다 보수적이며 업무와 관련된 여러 제도는 유명무실
워라벨 전반적으로 안좋으며 업무량 많음...
상하 및 부서간 소통이 안되서 업무가 답답함...
최근 과도한 목표로 직원들이 지쳐가고 있음..."
3,3,3,3,3,3,"업계선두다운 체계적 조직시스템과 안정적인 사업구조, 조직문화는 장점임",안정적이긴 하지만 60년 넘은 제조업체이기에 피하기 힘든 보수적성향은 존재함
3,3,3,2,3,2,"남녀비율이 거의 반반이라 의견 개진 자유로운 분위기
연차사용 자유로움
국내 및 해외여행 지원 혜택
개인 역량개발에 인사에서 많은 노력과 신경을 씀","보수적인 문화
탑다운 업무처리 많음
승진이 불공정한 경우 있음"
5,2,5,1,1,5,"다양한 업무해볼수 있음. 복리후생 괜찮음
언론에 많이 나오는 대기업임","비효율적 업무와 장시간 회의가 많음
업무시간내 회의하고 업무시간외 업무하게 됨"
2,3,2,1,1,1,"마케팅 사관학교라는 명성에 맞게 다양한 범위의 업무를 배울 수 있음
마케팅에 열정이 많은 사람은 재밌게 다닐 수 있음","복지제도가 다양하지만 쓸 시간과 돈이없음(연봉이 작은 편)
워라벨은 포기해야 함"
3,4,2,1,4,1,"연차 사용이 비교적 자유롭고 전반적인 분위기도 밝은 편
신입에 대한 교육 투자가 많고 여러가지 경험을 해볼 수 있음","야근이 많고 사원 대리급 연봉은 그에 비해 매우 낮은편
아랫사람이 책임을 많이 지는 구조"
3,3,4,1,3,2,"대기업다운 복지, 님 호칭 문화로 비교적 덜 수직적인 기업문화
일부를 제외하면 대부분 좋은 사람들","다양한 상품군으로 인해 경쟁사들도 많음
때문에 매출압박 많고 부진제품에 대한 대책보고 등 일과 외 업무도 많음"
3,3,2,1,2,2,"복지가 좋음(투섬, 올리브영 등 35% 할인), 저녁 제공(본사 기준),
영업할때 그나마 씨제이는 업계 1위라 타 브랜드보다는 수월함.","야근이 많은 편이고 페이퍼 업무를 많이 줄인다고 했으나 여전히 많음.
직무 순환 근무제가 제대로 안돌아감."
2,2,2,1,3,3,식품업계 대기업 복지 수준은 중간정도 식품업계들하고 비교시 연봉은 조금 많음,사업은 어려가지 하는데 돈 버는건 별로 없고 옛날것으로 벌어 먹는 중 현장직이라 꼰대 마인드가 많음
4,4,3,3,3,3,서울에 위치한 대기업이라는 것이 큰 메리트. 기업 분위기도 좋음. 제당 센터 아래에 식당이 있고 매달 신분증으로 식비가 들어옴. 신분증 사용하면 제당센터 음식들은 할인을 받을 수 있음. 어린이집도 회사 안에 있어서 출근한때 아이 맡기고 데려가면 됌,하지만 야근이 잦고 당연시 되는 문화. 삼☆만큼일하지만 연봉은 그것보다 적음. 패밀리데이 시행 처음에는 안내방송이 나와도 계속 일 했는데 요즘에는 그래도 칼퇴하라고 경영팀에서 돌아다님. E&M 분위기를 생각하면 안됌. 제당 분위기는 수직적 문화임.
1,3,3,1,1,1,대기업 생산직이라서 그런 지 다른 곳보다 일이 많이 힘들기 때문에 이직 시 택배 상하차도 쉬울 정도,하루 종일 기계처럼 라인이 돌아가기 때문에 업무강도가 매우 높아서 그런지 업무 분위기가 전쟁터 같음
4,5,2,4,4,3,"큰 성장 목표를 가지고 있어서 적극적으로 투자를 받고 있다. 연봉, 복지 모든 면에서 성장하려고 노력하고 있다. 다양한 사업 경험을 할 수 있다.",외부의 CJ이미지를 보고 들어오면 괴리감을 받을 것이다. 점차 나아지고 있지만 기업문화가 상당히 보수적이다. 또한 시스템적인 측면에서 아직 허술한 점이 많다.
1,2,3,1,2,2,이미지가좋음 여자들이 좋아함 씨제이 제품 35%할인 좋은복지,워라밸생각하면 안됨 식품영업은 야근이 일상화 대기업같지않은 문화
4,3,3,3,4,3,"님문화를 기반으로 열린 강한 수직구조는 아님.
새로운 시도를 많이 하고 글로벌 관련 업무등 다양한 경험이 가능함",평균적으로 업무강도가 좀 쎈편임. 평균적으로 연봉이 동종업계에선 높은편이지만 전체적으로는 높은편은 아님.
3,4,3,2,3,3,"1. 다른 대기업 대비 여자가 많아 복지 좋은편이나 팀별, 부서별 분위기에 따라 갈림
2. 다양한 부서와 일하기 때문에 이직시 유리, 본인이 성장하기에는 좋음","1. 식품업계 특성상 짠 연봉
2. 일이 너무 많아 워라벨 맞추기 쉽지 않음"
3,4,3,2,4,3,나름대로 수평적인 구조. 문화적인 혜택이 많음 근데 그것도 최소기간을 버텨야 받을수 있음,"비효율적인 구조로 다수의 직원이 업무량 과다로 지쳐했었음
추가수당이 제대로 지급되지않음"
3,3,2,2,4,3,"안정적입니다
임직원 할인률이 좋습니다
님 문화로 상사의 폭언이 적습니다","결정적으로 연봉이 적습니다. 제일짜당...
필수적으로 잔업을 하게 만드는 분위기"
2,3,1,2,2,2,"복지는 다른 대기업 부럽지 않음. CJ 계열사(빕스, CGV, 올리브영 등)는 무조건 35% 할인 받고, 자녀 학자금, 대출, 사내적금 등등 복지는 진짜 좋음.","단점은 생산직으로 근무하게 되면 그 복지를 쓸 시간이 없음. 그리고 급여가 대기업치고 굉장히 짬. 야간 포함 3조 3교대였고 한달에 3~4일 정도 휴무, 잔업이 150시간 정도였는데 실수령액이 280만원이 안됐음. 또 공장내에 여사원들이 별로 없고 대부분 남사원들이다보니 군대적 분위기가 남아있음."
2,3,2,1,2,2,35프로의 복지와 여성친화적인 이미지로 계속들어오는신입사원,페이퍼워킹이많으며 부서간의 알력이심해 협업이어려운경우가 다수임
2,3,2,2,3,3,"계열사 할인 및 식당가 이용이 가장 좋았던 점
노트북 사용으로 회의시 또는 출장시 항상 휴대할수 있는 장점",잦은 보고 및 보고서 작성. 새로운 아이디어에 대한 끊임없는 고민이 필요하나 해야할 일이 많아 항상 시간이 부족
3,3,2,3,3,2,국내에 근무할 경우에는 서울에서 근무 할수 있음. 공대생으로 서울에 있을 수 있다는 메리트 있음. 밥은 맛있고 cj계열사 35프로 할인은 좋다. 야근은 많이 없는편,"서울에 있을수 있는 기간이 길지 않다는게 단점. 비교적 후진국의 오지 공장에서 근무 해야한다는게 치명적 단점이 될 수 있음.
또 아미노산 산업군 자체가 미래 전망이 좋다고 보기는 힘들다."
3,4,2,3,4,2,그룹 핵심계열사로서 내수로 안정적인 매출이 보장되어 고용보장이 됨,대외적으로 높은 기업 이미지와는 달리 수직적이고 보수적인 문화. 식품업계로서 업무량에 비해 낮은 연봉.
5,5,5,5,5,5,~님 문화가 잘 자리잡혀 있고 구성원간 서로를 존중해주는 기업 분위기,회사 규모에 비해 인원이 부족해 업무강도가 세서 개인시간이 부족하다
3,3,2,1,3,3,이미지 좋음 여자가많음 개인의 자유존중됨 문화복지좋음,낮은연봉 낮은인상률 다른대기업들 보며 부러움 눈치보며퇴근
3,3,4,2,2,2,식품 회사 중에서 급여는 높은 편. 계열사가 많아 복지 혜택이 다양함. 인지도가 좋음. 탄탄한 기업.,연령대가 높아 군대식 문화가 자리 잡고 있음. 매일 야근함. 학력에 따른 대우가 다름.
3,3,2,2,4,3,"식문화를 선도한다는 비젼이 뚜렷하고 사람들이 좋다
과장 이상되면 연봉이 많이오른다
사람들 간에 화합이 잘되는 편","수직적이고 보수적인 문화
어느 특정 사람에 의해 휘둘리는 경향이 있음"
4,3,4,4,5,3,팀마다 분위기가 다른데 내가 있던 팀은 가족적인 분위기였음. 복지문화가 좋긴함. 우리팀은 연차도 퇴근도 눈치안봄 윗사람이 누구냐가 팀분위기를 좌우함,시키는 일이 너무 많음 .. 그리고 이것저것 복지라고 뭘 하고 독서모임에 강의도 들으라하고 하는데 가끔은 업무를 방해받는 느낌이엇음 ㅜㅜ 퇴사하는사람 정말 많고 안정적인 느낌이없는 회사
1,3,1,1,1,1,"생활 속에서 활용할 수 있는 복지가 꽤 된다는 점
이것저것 할인해서 살 수 있음","주말에 메일을 보내서 월요일에 보고하라고 하는 도넘은 비상식.
당연히 주말근무 할 거라는 전제가 깔린 업무지시.
구성원간 전혀 공감대가 형성되지 않은 탑다운 GCP 숫자놀음.
보고된 숫자면 니 사정은 알 바 아니고 어떻게든 해 오라는
보고 지상주의 혹은 보고 노이로제.
자기 자리를 지키기 위한 구성원 개인 시간 착취.
IT투자 없이 사람이 수레 끌듯이 하는 노가다 엑셀질의 미개함.
전반적인 몰상식이 조직에 만연.
한마디로 발전이 없는 회사.
대기업이라는 타이틀이 창피.
이름만 남은 패밀리데이, 새벽까지 허무하게 일하는 구성원들에게
7시에 나오는 퇴근방송은 분노를 유발.
너무나 경직된 조직문화에 경력직들은 어김없이 부적응자행.
입사하려는 사람이 있다면 술한잔 사주면서 뜯어말림."
3,3,2,1,1,3,입사 초기 임직원 할인이 좋아 자발적으로 CJ에 묶임. 지방의 경우 빵과 커피 이외에 혜택은 거의 없음.,"어마어마한 결재라인, 담당자 책임제(노블레스 오블리제 부재), 소단위 공장이 전국에 있어 전국이 근무지가 될수 있음."
4,4,4,3,5,3,인턴이어서 그런지 눈치를 주거나 그러지 않고 편하게 대해줌. 사내 문화가 유연한듯,업무 강도가 너무 강해서 힘듦. 업무 강도에 비해 연봉은 쎄지 않은듯
2,3,2,2,2,1,중공업 제조 대비 유연한 기업문화이나 기대수준 이상일지는 개인판단의 몫 생활문화기업인만큼 생활밀접형 복지는 좋다고 볼수있음,"보수대비 업무강도가 높아 직원만족도가 낮은편. 대외이미지에 비해 수직적이며 보수적임
대내외적으로 혁신 개혁 등 기업문화에 있어서 젊어지려는 노력을 하는것은 긍정적으로 평가되나 기대만큼의 수준으로 올라갈지는 수년내로는 힘들것으로 봄. 망하지는 않을 회사이며 경기방어적업태로서 현재와 같은 불황기에도 성장을 하고있다는 면에서 투자자로서 나쁜회사는 아니지만 고용인으로서는 힘듦."
3,4,2,3,4,3,담당 업무 수행으로 눈치없이 자기가 하고싶은 업무 관련 일들을 해볼수 있다.,재직당시 팀장급 리더쉽에 문제가 있어 많은 사원들이 나감
3,3,3,1,2,1,"자기 개발의 기회가 많음
저 연차에도 다양한 업무경험가능
식품업계 최고 복지","보고 체계가 복잡하고 보고서가 난무함
수시로 바뀌는 장기 계획
은근 군대식문화, 조직장인 부장이나 임원진에게는 해당없는 님문화 , 담당님 대표님 부회장님 등등"
3,3,3,2,3,3,복지는 괜찮으나 연봉은 동종업계에 비해 높지는 않다고 함,근무시간은 부서마다 다르며 늦게 퇴근하는경우가 많음. 또한명절에 매우 바쁨
3,3,4,2,3,3,"식품업계 1위의 회사로 자부심도 많고 , 복지혜택(씨제이 관련 35프로 할인)이 나쁘지 않다.",말로는 유연한 수평문화라고 하지만 실제 말하몀 쩩히고 고과시 반영됨. 일찍퇴근하면 좋아하지않고 야근을해야 일잘한다는 인식이 아직 남아있음
2,2,2,1,2,1,수평적으로 개선되려고는 하나 고졸과 옛 방식의 보수적인 마인드로 기업유지하려하기때문에 고지식과 수동적인 행동을 습관화 할 수 있다,"물갈이를 하지 않는 이상 변하지 않는 문화, 혀를 차게하는 작업환경과 업무강도 그리고 동기를 다시 만나기란 하늘의 별따기인 높은 퇴직률"
4,3,3,3,3,3,"부서마다 다르지만 연차 사용에 대한 터치가 거의 없음
단, 타부서원이 피해를 보지않는 한도 내에서만","사업의 규모나 업무 강도에 비하여 낮은 연봉
대기업이다 보니 의사결정 과정애서 수반되는
서류 작업이나 보고 관련 서류 작성일이 많음"
3,4,3,1,2,2,"다양한 사업군을 보유하고 있고 배울건 많은 회사.
특히 계열사직원할인이 가장 큰 메리트, 이것때문에 퇴사자들이 한번더 고민함","이미지메이킹의 끝판왕, 실제로 하는 일은 고된일이 많음, 2020년까지 엄청난 목표를 정해놓고 시장상황과 내부협의없이 경영목표떨어짐, 목표달성을 위해 끊임없는 챌린지가 난무하는걸로보아 2020년 계획은 얼추 달성할 것같으나 그곳에 다르기까지 직원들 죽어남, 입사계획있다면 2020년 이후로하길"
2,3,3,2,3,2,"역시나복지가 좋습니다.
돈도나쁘진않은데 일이많아요.
그래도 성취감은있습니다","일많고 야근이많은게 단점입니다.
일이너무많아요.
다른단점은 딱히없네요"
3,2,3,2,2,2,복지. 교육이 많음 명함 내밀기 좋은나 업무량많아 지치기 쉬움,보고가 많음. 의사결정이 소수에 몰려있어 시간걸리고 비효율적
4,4,4,4,5,3,님문화는 잘 정착되어있음. 남녀비율 적당하여 군대문화 없음. 담당하는 업무에 대해 집중하여 일할 수 있음.,타 대기업에 비해 낮은 연봉. 님문화 쓰라면서 회장님 부회장님 등에게는 안씀. 재벌기업이라 어쩔 수 없는 문화도 존재함.
2,2,3,1,2,3,"복지라 할 수있겠습니다. 문화생활전반에 cj계옐 음식이면음식 영화 화장품등등 남자들보다 여자들이좋은듯
그리고 좋은기업이미지","좋은기업이미지 젊어보이는 기업이미지 비해 근무환경은
70년도 공장그대로. 사건터짐 숨기기급급 사람안전보다중요한 무재해 신입열명들어와서 1명남음"
2,2,1,3,3,1,"CJ복지포인트 및 계열사 할인 혜택, 네임밸류, 돈안드는 의사결정은 그나마 빠름. 사람좋은 업무환경, 최근시작된 자율복장제",야근을 종용함에도 불구하고 평일야근비 거의 전무하며 주말근무비도 매우 짬. 기술력과 업무방식 모두 대기업같지 않고 실망스러움.
4,3,3,1,3,2,복지혜택과 인프라 구내식당 양호함 특히 여성이 많이 근무하고있어 회식 문화가 좋음,"문서작업이 많음
업무강도가 너무 세서 업무 제외한 자기 개발에 대한 시간 전혀 없음
일을 하는사람만 계속 일을 주는 시스템
성과평가제도에 따라 경쟁심리 심하고 이기주의 개인주의가 팽배함"
3,4,3,1,2,2,'님' 호칭 문화로 인해 직원간에 수평적인 문화. 생활 문화 기업인 만큼 복지 특히 여성들을 위한 복지가 좋은편.,"출근시간이 매우 빠르며, 업무 강도가 매우 강하다. CJ 그룹의 cash cow 역할을 하는 만큼 그 무게가 대단하다."
4,3,4,4,4,3,"연차사용에 눈치보이지 않고, 복지혜택이 우수하며, 깨끗하고 좋은 건물에서 근무가 가능함. 전반적으로 직원들이 유순하며 수평적 문화가 있는 편임. 부서별 차이는 있지만 퇴근시간으로 눈치받지않음.","최근 2년간 CJ정신교육을 위한 잦은 회의와 활동이 중복적으로 많았으며, 주기적 봉사활동 강요 등 외부에 보이기 위한 활동참여가 많음."
1,2,2,1,1,1,많은 복지제도. 국내 및 해외 숙소 제공 및 다양한 계열사의 다양한 제품 할인 혜택.,쓸데없이 이른 출근 시간과 늦은 퇴근. 과다한 업무량. 높은 퇴사율 등 장점을 제외한 부분.
4,4,4,3,3,3,다른 생산직종에 비해 급여가 괜찮고 근무 환경이 깔끔하며 열심히만 한다면 승진의 기회도 많이 있다,복지 정책은 다양하지만 실행되고 있는건 미비하고 휴게 시간이 너무 적다
3,3,4,3,3,2,"까페테리아 포인트를 비롯한 복지는 좋은편. 본사 내 어린이집, 지하 식당과 슈퍼마켓 등이 잘 구비되어 있음.",형식적인 보고와 미팅이 많은 편임. 내부적으로 한페이지 보고서 등의 캠페인도 진행하였으나 큰 효과는 없음. 근태에 대해 매우 경직되어 있으며 업무와 관계없이 눈치를 보며 야근해야 하는 경우도 종종.
5,5,5,4,5,3,"복지와 교육
급여 가족같은분위기 개인의 역량을 키울수있음",회사가 대체로 너무 성과위주의 조직운영이 심하다 경쟁을 부추김
