star,promotion,welfare,worklife,culture,ceo,merit,disadvantage
2,1,2,3,3,1,계열사 할인이라는 복지. 그러나 쓸수있는 한도도 정해져있으며 오히려 소비를 유도하여 낮은 연봉에 비해 좋은지는 모르겠음.,개인 성장가능성의 부재. 연봉으로 말이많다. 최적화라는 모토답게 기업은 최소비용 최대효용을 내려고 하지만 너무 복지로 퉁치는 느낌. 턱없이 적다. 충성도가 생기지 않음.
1,1,1,1,1,1,"식품업계특성상 망할일은없습니다
장점이없어서 적고싶어도적을게 없습니다","국내유일의생산직인사평가제도 인사고과싸움때문에 동기들끼리등에칼꼽는게현실
낮은연봉으로 월급받으면 보험카드값빠지면남는게없을정도...
님문화라고수평적인문화를지양하지만 하나도지켜지지않고 폭언,폭설이난무하는회사 심할경우가끔폭력도있습니다
CJ특유의문화와 군대식문화가어우러져 더욱더 나쁜점만쏙쏙빼서적용
일하는도중다치면 산재처리는해주지만 그이후로사람취급못받고 인사고과에서밀려서 신입보다 연봉이낮아질수도있음
방진복겹겹이 입어야함 평균온도40~50도
하루에옷8~9번은갈아입습니다
일할때휴대폰소지불가 반납하고입장,입수보행금지 자유도가없는회사
답이없는회사,생산직직원의90프로가이직을원함"
3,2,3,2,3,2,모든 사람들이 알만한 네임밸류. 뻘짓만 하지않으면 짤릴일이없다,고졸 전문대의 한계가 느껴짐. 열심히해도 올라가는데 한계가느껴짐
4,4,3,4,4,3,"복리후생 최고 이용할수 있는게 되게많음
네임벨류 최상위","업무강도가 천차만별, 입사하면 선택 잘해야함
힘든곳은 최악"
5,5,5,5,5,5,"복지가 좋아요 안정적이고 사업이 호황이에요
절대 안망할 회사","식품회사답게 연봉은 타기업들에 비해 적기는 합니다
근무강도는 좀 있는것 같아요"
3,3,2,3,4,2,기업 문화가 수평적으로 형성되어 있다. 또한 자유롭게 일 할수 있는 분위기가 형성되어있어서 개인적으로 매우 좋았다. 연월차의 사용은 매우자유롭다.,업무량이 많은 편이다. 다른 직원들에게 들어본 결과 임금에 불만을 가진 인원이 많았다.
1,3,1,1,3,3,복지말고는 없음 문화를 창조한다는 기업이지만 정작 올리브영이랑 투썸밖에 안씀,낮은 급여 20년 넘은 직장 연봉이 8000이고 지금 2년차인 내 기본급은 208만원 오티없이 야간수당만 받으면 한달에 200가져감
5,5,5,5,5,5,"연차를 눈치안보고 쓸수 있음 마음맞으면!
정해진 퇴근시간 쉬는시간준수",잦은 교육이 있어 재시간에 퇴근이 늦을 수가 있는 경우가 있음
1,3,1,1,1,1,장점이없어 장점을 적어야될지 모르겟지만 굳이 하나꼽자면 복지 말고는 없습니다.,"부서마다 틀린대 연차 눈치보고써야됩니다. 연차한번쓸려고하면 다른회사 이직하면서 눈치주고 힘듭니다,낮은연봉 근무강도 상 식품회사 특성상 매운 더운 근무
폭언,폭설"
3,3,5,3,5,3,복지 근무환경등 다좋다고 생각이든다 복지하나는 기가막힌딘,월급이 타사에 비해적고 연봉폭이 크게 오르지 않는다 그부분이 아쉽다
4,5,2,5,5,5,업무량이 많지 않음. 서로 배려해주는 분위기와 호칭. 구성원들이 매우 성실하며 모두 착함.,처음에 파트타이머 3개월 하기로 했어도 1개월마다 계약서를 나눠서 씀. 고로 주휴수당 제공이라고 써있지만 달이 바뀌는 주는 계약서를 새로 쓰기 때문에 주휴수당이 안나옴. 점심이 제공되지 않음이라고 공고에 기재되어 있음. 회사 식당이 있지만 아르바이트생은 직원이 아니기에 8천원임. 식당 말고 주변에 먹을 곳이 마땅치 않으므로 20분정도 걸어서 나가야 하기에 밥만먹고 들어와도 점심시간(1시간)끝남.
2,3,3,2,3,3,"꾸준히 성장하는 회사이기에 식품산업 내에서
다른 기업과 브랜드보다 영업하기가 수월함","무조건적인 성과지향적인 기업문화로,
그 과정에서 보람이나 성취감은 찾아볼 수 없음.
영업사원은 늘 잘못한 사람."
5,4,4,5,4,4,부서마다 다르나 기본적으로 휼륭한 인재육성 프로그램을 기반함,일부 꼰대들의 나몰라라 마인드는 기업문화 및 조직문화를 매우 저해함
1,2,2,2,2,2,업계 내 1위 대기업으로 적당한 네임벨류 및 동종업계 상위연봉임......,업종 급여수준 한계로 여타 대기업 대비 매우 적은 연봉. 높은 근무강도 등 단점이 있으나 인턴근무로한계가 있음
3,3,3,2,3,3,"복지가 상대적으로 좋은 편이며 직원들이 얻을 수 있는 혜택이 많은 편임. 외식, 문화, 등 등 사업 관련 혜택이 주를 이룸",전형적인 조직문화를 보이며 상하 수직 때로는 정치를 해야 적응이 쉬움. 튀지말고 적당히 수긍하는 사람이 오래감.
3,3,3,2,2,2,국내 식품 1위 기업으로써 직무를 좀더 세분화하여 배울 수 있음.,수평적이어보이지만 아직까지도 꼰대문화 다수 존재. 영업은 군대문화고 다른 직무들도 눈치밥은 필수
3,3,3,3,3,2,"계열사 (올리브영, 투썸, 빕스) 등을 40% 임직원 할인을 받을 수 있음.","유연근무제도 실시하고, 다양한 조직문화 혁신을 위해 노력하지만
여전히 보수적이고 깨어있지 못한 경영진들."
2,2,3,1,1,3,올리브영 등 계열사 40프로 할인과 다양한 브랜드에 대한 경험,과도한 업무양으로 야근이 많고 간부급의 권위주의적인 문화가 형성되어 있음
3,3,4,2,3,2,일단 복지가 잘되있고 대외적인 이미지는 정말 좋은회사,동종업계에선 상위권연봉이지만 식품이라는 특성상 다른 대기업에 비해 적은 연봉
5,4,4,5,5,2,"지방 사업장이라서 본사는 잘 모르겠지만, 제가 있던 곳은 좋았습니다. 연봉은 타 기업에 비해 엄청 많이 주는 것은 아니지만 만족할만 했고, 일단 기업 이미지가 좋아서 외적으로 자랑?할만했습니다. 내적으로는 사람들 괜찮고 챙겨주는 분위기입니다.",다른 리뷰 쓰시는것 보면 안좋다고 생각할 수 있는데 일단 대졸사원입장에서는 큰 단점은 없다고 생각합니다. 다만 생산직분들 대우는 그리 좋지 못한것 같습니다.
4,3,4,4,4,2,"직원할인 혜택, 복지 혜택, 유연한 근무 환경, 개방적인 사고방식, 젊은 직원이 많은 활기 넘치는 환경","책임 떠넘기기 식, 보여주기 식의 업무, 보고를 위한 업무, 오늘을 위한 업무 위주, 이기주의 팽배, 바쁜것 같지만 정작 하는것은 없는 업무 구조"
3,2,2,2,4,3,"패키지 디자인센터가 있음, 인턴으로서 다양한 실무경험을 할 수 있음, 점심메뉴 다양함","대기업인데 그에 비해 적은 월급, 야근이 많은편입니다...."
4,3,3,3,3,3,해외진출이 많을 것으로 예상되어 미래를 투자할 가치가 있는 회사,너무 압박적인 생산으로 인한 현장직들의 피곤함이 있다.
4,4,3,4,4,3,"유연근무제, 창의휴가, 계열사 임직원 할인 등 복지 좋음",내세우고 있는 슬로건과는 달리 후진적이고 보수적인 업무 의사결정
4,4,4,3,4,3,복지혜택은 좋음. 사내문화 개선 분위기 강함. 네임벨류 강함,낮은 연봉... 높은 목표와 업무강도...인센티브도 엄청 짠편
4,4,4,4,4,4,"좋은 복지 동종업계 최고연봉, 직무순환이 가능하며 도움이 많이된다","왜하는지 모르는 취합, 남아있는 군대문화. 흔히말하는 꼰대들이 많이있다"
3,3,3,2,3,3,저연차에 많은업무를 경험해 볼 수 있음. 복장이 대기업 제조업치고 자유로운 편. 임직원 할인은 주변사람들의 워너비 혜택,전반적으로 워라벨은 안좋은 편. 페이퍼 워크가 많은편이고 대외적인 이미지와는 달리 군대문화 일부존재.
4,4,3,2,2,3,"기업 문화는 확실히 좋아지고 있음. 복지 포함.
여성에게는 좋은 복지, 남성은 크게 인식 못할 수도",영업본부는 확실히 과거의 시대에서 벗어나지 못하는 모습
2,2,3,1,1,2,교육시스템이 잘 갖춰져 있고 멀티플레이어를 좋아하는 경향이 있어 업무배우기엔 좋음,"야근이나 주말출근은 필수 연차쓸때 눈치줌
약간의 군대 문화가 남아있음"
3,3,3,3,3,3,최근 복지가 많이 좋아지고 있음 대외적으로도 인지도 많이 오름,보수적인 부분이 많고 인센티브가 너무 짜다. 그리고 보여주기식 업무가 많음
4,4,3,3,4,4,"복지 시스템
교육
문화적인 써포트
다양한제품군의 커리어","많이나아졌지만 워라벨과 지나친성과주의
씨제이 기업가치세뇌"
3,3,4,3,3,3,"자기분야의 전문성을 기를 수 있고, 복지가 좋아서 꾸준히 다니기에 좋은회사","문서작업이 많아서 비효율적,
메뉴얼이나 프로세스가 구축되지않은 느낌
그리고 보수적인 경향이 많아서 신세대 회사 느낌이 안남"
5,4,3,1,3,3,"인사체계가 잘 잡혀 있고, 성장을 위한 자기계발 기회가 많다.",업무 시간이 길고 군대문화가 있어 여자들이 근무하기에 어려운 점이 많다.
2,3,2,2,2,1,계열사 할인이 되서 지인들에게 자랑하기 좋다. 건물이 뭔가 크고 그래서 보여주기 좋다.,연봉이 매우 짜고 수직적고 딱딱한 기업문화 위에시키면 시키는대로 해야 하는데 매우 수평적인척 한다
3,3,3,4,3,3,대기업으로의 네임이 있어서 좋음. 대기업 복지를 이용할 수 있다.,승진을 하기에는 한계가 있는 것 같고 기업 문화는 비교적 보통이나 때론 이해하기 어려울 때도 있음.
3,3,3,2,2,2,"복지는 나쁘지 않음. 각종 혜택이 잘 되어 있음.
마케팅 능력을 크게 키울 수 있음","대기업이라고 하기엔 연봉이 높지 않고, 식품회사 중에서는 높은편이라고 볼 수있음.
야근이 많다
중요 업무에 대한 경영진 개입이 심함"
3,2,3,2,4,2,"케주얼 복장 및 과장급까지는 유연해 보이는 문화, 같은 업종 국내기업 대비 처우가 나은편, 사원 대리들에게 많은 신경을 쓰는 인사문화",간부급 중간 입사자 적응 어렵고 폐쇄적인 문화. 야근 많고. 불필요한 보고 과다
4,5,3,3,4,3,"님문화 정착으로 구성원 간에 수평적인 관계를 유지하려고 노력하는 회사
글로벌에 진출하는데 적극적으로 도움을 주는 회사","대기업치고는 낮은 연봉
근무강도는 높은 편
실적압박이 강함"
3,3,3,4,4,3,"식품업계 1위 기업
광교 rnd센터는 지어진지 얼마 되지 않아서 깔끔하고 좋음
정말 이 기업에 애정을 갖고 있는, 이 곳에 꼭 입사하고 싶은 학생들이 ⭐️잠깐⭐️ 파트타이머로 근무해보는 것 추천.
함께 일하는 팀원분들은 정말 좋았음.","시급에 식대 포함인데, 연구소 구내 식당에서 외부인이 먹으려면 9000-10000원? 정도 여서 그 시급을 받고 식사를 해결하기 어려움. 최저시급수준.
출퇴근 기록을 스스로해야하고, 일 없으면 일찍 보내거나 원치 않는 강제휴가를 줌. 계약 상 근무시간이 8시간/1일 이라고 해도 실제는 초과근무한 시간을 계약 근로시간이 부족한 날에 끼워넣음. 따라서 초과근무수당(1.5배) 전혀 없음."
4,3,4,3,5,4,기업문화 좋음 여성의 비율이 높음 여성이 다니기 좋은 직장,채용형 인턴만 인턴으로 취급하고 본래 체험형인턴이었던 자리를 아르바이트로 처리함
3,2,3,2,2,3,"계열사 복지 좋음(40%할인, 해외여행 지원제도가 가장 좋은 듯), 여자가 결혼해서도 다니기 좋은 회사","아직 남아있는 수직적인 군대문화와 꼰대마인드를 가진 윗사람이 너무 많음, 구성원을 쳇바퀴같은 기계로 생각함"
4,3,3,4,4,3,"복리후생이 좋고, 대외적으로 기업 이미지가 좋다. 개인의 성과를 인정해준다.","임원 직원간의 연봉 격차가 크고, 수평적인 기업문화를 지향한다지만 나이가 있으신 분들은 그런 문화를 받아들이지 못함"
2,1,2,2,1,1,임직원 40% 할인은 장점. 그러나 남자라면 본인보단 가족과 여친이게 필요한 혜택,아닌척 하지만 수직적인 꼰대문화가 팽배해 있는 곳. 대기업치고 낮은 연봉.
3,4,2,1,3,3,"도전정신이 뛰어나고 일욕심 많은 사람에게는 좋은 직장, 임직원 할인 혜택이 많으며 역량만 된다면 V/C간 이동도 쉽게 가능함. 시스템이 효율적으로 잘 되어 있음","보고가 많으며 의사결정이 늦고 효율적이지 않음. 일정을 너무 쪼아대고 숨막히게 함. 상사들이 집에 잘 가지 않고 야근, 회식이 많음"
4,4,4,3,4,4,"가고싶은회사 3위안에 무조건들고, 임직원 카드가 굉장한 혜택임",밖에서보는것과 안에서 보는게 다른 대표적회사라고 생각함
5,4,4,4,4,4,"딴공간이라고 쉬는 공간이 마련되어 있으며 안마기, 간이침대들 컨디션 관리 용이. 그 외에 근무환경 또한 최고.",아르바이트였기 때문에 길지 않은 시간동안 큰 단점은 느끼지 못했음. 좋은 경험이었음.
3,3,3,1,1,1,다양한 업무와프로젝트를 단시간에 해내는 경험을 자주 하게 된다 그만큼 개인의 업무 처리량 등 발전 속도는 높음,건강이 상하는 경우가 다반사 물론 팀 차 개인차는 존재함
3,2,3,3,3,3,사내교육 잘되어 있어 의지만 있다면 다양한 컨텐츠 활용하여 자기개발하기 좋음. 계열사 할인 중 특히 올리브영 할인은 퇴사하고 나서 가장 아쉬운 부분,"겉보기에 굉장히 세련 된 이미지지만 내부는 매우 보수적이고, 업무량 많음. 속한 팀은 의견개진하기도 힘든 부분이 많았었는데 최근에는 그래도 사내 분위기가 많이 유연해졌다고 함."
2,3,5,1,3,3,"복지 혜택이 많습니다. CJ카드,많은사람들이 알고있는 기업이미지로 굳이 어떤설명을 하지 않아도 사람들이 부러워 합니다.",좋은 복지 혜택을 나는 이용하기 어렵습니다 잦은 야근과 업무 강도로 항상 발전해야하는 점이 있습니다. 삶과 균형을 이루기가 어렵습니다
4,4,3,4,4,2,"제조업치고 '비교적' 수평적인 문화를 지향, 회사 차원에서 노력중. 복지 좋고, 여자가 일하기 좋음.(여자에 대한 차별이나 유리천장이 굉장히 낮은 편) 마케팅 중심의 회사로 마케터로서 비전 있음.","대기업치고 초봉이 낮은 편, 인센티브도 크지 않음. 식품이라 상품의 주기가 매우 짧기 때문에 피곤함."
3,4,4,2,4,4,자유로운 분위기. 업무에서 자신이 의도하고 희망하는 목표를 달성할 수 있도록 회사가 지원해준다.,너무 많은 취합. 데이터를 너무 많이 요구한다. 매일 3~4개의 취합이 있다.
3,3,4,3,4,3,"복지혜택은 최상위급, 수평적 문화라 일 자체는 할만함. 연차 자유롭게 가능","일이 너무 많아서 야근이 잦음, 소위 워크앤라이프 밸런스가 깨짐"
3,3,2,2,4,3,"복지 잘만 활용하면 다양한 혜택을 누릴 수 있음
님자 호칭 문화로 비교적 수평적인 분위기
대외적 이미지 좋음","대기업 치고 연봉 수준이 낮음
높은 업무강도와 비효율적 방식에 대한 불만"
2,3,1,1,2,1,"영업을 제외하면 비교적 자유로운 복장
(여자는 청바지까지 가능, 남자는 셔츠에 면바지까지.
영업은 정장)","1. 대기업이라고 하기 민망한 연봉
- 롯데나 아모레랑 기본급은 비슷하나 성과급이 거의 없다
(아무리 실적을 달성해도 추가목표를 얹어주기따문에 차창급이상아니면 성과급이 1천이 안된다, 물론 차장이어도 한푼도 못받을 수도 있음. 성과를 엄청나게 잘 달성하면 1천쯤 나올 수도 있다는 얘기)

2. 연차사용이 어려움
- 연차쓰면 엄청 뭐라하고 편하냐고 자꾸 묻는다.
그리고 여성의 경우 생리휴가가 없다.

3. 잦은 회식

4. 여자가 다니기 좋다? Nono
다녀본 사람이면 그런말 못한다. 결혼한다고하면 축하인사보단, 그럼 너 이제 집에 일찍갈꺼냐? 라고 묻는다. 애 키우면서는 다니는 사람 거의 없다

5.성희롱 만연
동료 여직원들을 대상으로 음담패설도 꽤 있고, 팀장급들은 여사원 터치 많이함(마사지 해주겠다는등) 그리고 여사원에게 갠톡보내는 사람들도 꽤 있었음.(업무와 무관하게)"
3,3,2,1,1,1,1등 회사. 연수기간이 길다. 씨제이라는 나름의 자부심이있다.,"취합취합취합. 끝없는 취합.

성과 미달성 시 그에 대한 이유와 해소방안을 지어내기 위한
끊임없는 야근

군대문화를 넘어서는 일진놀이같은 문화"
4,4,4,3,4,4,"수평적인 조직문화, 이지만 아직 야근에서 자유로운 편은 아닙니다. 하지만 여성들의 편익을 굉장히 배려해주는 편임","수평적 조직문화가 과도기적이라는 측면이있음, 역차별 현상이 발생하는 경우도 있습니다. 그리고 이기주의적인 성향도 배제할 수 없슴"
3,3,2,3,3,1,나름 문화를 선도한다는 슬로건 아래 유연한 조직문화를 그리려고 노력함,"시스템, 인프라가 매우 부족함.
연봉은 높은 수준이나, 인센티브가 매우 적음."
3,3,4,3,2,2,"복지는 굉장히 좋은 편임. 여자가 다니기 좋음
망할 가능성 0%","식품사업이 6.25 이후부터 시작되면서 노후된 공장이 많음(열악함)
화끈한 투자 같은게 없음"
5,5,4,4,5,5,"문화기업에 걸맞게 트랜드한 분위기, 잦은 야근으로 유명한 기업이라 하지만 최근 진행된 인사개혁과 여러가지 노력으로 워라벨이 잘맞다고 생각됨.","타 대기업에 비해 낮은 연봉, 국내 식품업계 최고 대우의 회사인지라 이직 시 마땅한 선택권이 없음."
5,3,5,4,5,3,"국내 브랜드중 탑3아닐까 싶음. 복지가 진짜 좋음.
특히 여자들에게 좋음",개방적이고 진보적인 이미지브랜딩만 추구할뿐 현실은 군대. 하지만 이건 어딜가나 마찬가지아닐까? 단점이라고 꼽으라면 꼽겟지만 굳이 단점은 없는듯
4,4,4,4,5,4,"대부분의 팀 분위기가 아주 수평적. 야근 일주일 1번? Cj 계열사 ( cgv vips 올리브영 투썸 등등.. ) 40퍼센트 할인된가격 이용 가능하다는 엄청난 복지.
무엇보다 해외출장, 근무가 많은데 이게 장점이자 단점. 해외에서 사는걸 좋아하신다면 가족들 귀족처럼 살게해줄수있음.","잦은 해외출장, 주재원 나갈 시 5년정도는 해외에서 근무해야함.
따지자면 식품회사니까 연봉이 타 대기업에 비하면 아주 높은편은 아님."
3,4,3,2,4,3,"해외사업에 대한 커리어를 쌓기에 좋은 기업
복리후생은 그 어느 회사와 견주어도 우월한 기업
수평적 조직문화에서 비롯된 업무자율성","보고를 위한 보고. 보고문화를 줄이기 위한 보고.
비생산적이고 반복적인 페이퍼워크의 지속성으로 업무에 지치고, 흥미를 잃게됨.
일은 힘들어도 재미있으면 만사OK인 것을.. ""하기싫다""가 먼저 떠오르니.. 이거참.. 언제나 좋아질지.."
1,2,3,1,2,2,급여와 버틴다면 오래동안 일을 할 수 잇다는 점이 있다,하지만 결숙 생산직 나의 시간이 사라진다. 교대 근무는 어디가나 힘듬
3,3,3,3,3,3,일단 많이 알려진 대로 여성이 다니기 좋은 기업은 맞는 것 같음. 유연근무제 도입으로 출퇴근 시간에 나름의 유연성이 생겨 비교적 과거에 비해 편하게 다닐 수 있는 것 같음,실적압박이 많이 알려진대로 좀 있음. 또한 사무직과 공장에서 일하는 생산관리팀과의 업무량이나 분위기가 차이가 많음. 고졸출신의 상사가 많아 아직 군대식 문화가 자리잡고 있는 곳이 많음.
4,4,4,4,4,3,"다양한 복지혜택(임직원 할인40%, 배우자 출산 남자 휴가 2주, 근속년수 5년,10년에 따라 창의휴가 한달, 글로벌역량을 위해 무급 6개월 어학연수 가능, 출퇴근시간 자유롭게 조절 가능 등 임직원들의 사기진작을 위한 인사혁신 제도 대거 시행.",팀바이팀이지만 야근과 보고가 많은 부서도 있음. 물론 그러한 과정에서도 배울 건 있음. 덩치가 큰 기업이다 보니 업무를 다양하게 배우는데 한계도 보임. 직무 이동이 잘 안되면 성장하기 어려움.
4,4,4,3,4,3,"개인의 능력만큼 대우 받는 곳, 그렇기때문에 자기 업무에 대한 뛰어난 지식이 있어야 함. 능력이 좋고 주어진 일을 빠르게처리할 수 있다면 연차, 휴가 등에 눈치 안볼 수 있음","조직의 목표와 현실 사이 괴리감이 큼, 실제 터무니없는 목표를 이루기 위해 눈가리고 아웅식이 잦음 그러나 내부적으로 이러한 문제를 없애기 위해 꾸준히 노력 중"
4,4,4,4,5,4,"일반적으로 개인의 활동 및 선택이 존중됨. 일에 얽매이는 경우가 다소 있으나, 어느정도의 밸런스가 있음.",보고가 많음. 매출의 압박이 큼. 인력이 부족한 경우가 많음.
3,4,3,4,5,5,복장이 자유로움 최근들어 정시퇴근을 강조하는 문화 복지혜택 좋음,영업이라는 직무 특성상 매월 실적 압박이 심함 연봉이 타 대기업에 비해 짠편
1,2,3,1,1,1,"국내 식품부문 1위 기업다운 업계 내의 위상. 을 중에서 갑.
복지는 좋고, 점점 더 좋아지려 한다.","당근보단 채찍문화. 수평인 척 하는 수직문화
또한 조직에 완벽히 융화된 젊은 꼰대들이 상당히 많다."
2,4,2,1,4,2,"수평적 분위기 님자가 형님 누님이 되기도 함
해외 출장 기회 많음","연봉이 너무 짬
사람을 더 뽑을 생각을 하지 않고 2인분 이상을 1명에게 시킴"
1,1,2,1,1,1,"-임직원카드로 누리는 다양한 할인 및 혜택들.
-중소기업에 비해 법을 나름 지킴.
-식품회사라 그런지 밥은 맛있게 나옴.
-공장 생산직의경우 많이 채용하는듯함.","-많이 채용하지만 숫자는 그대로인 극악의 퇴사율.
-님자 호칭이 형님,누님으로 바뀌는 마법의 사내문화.
-밥은 맛있지만 그것도 CJ제품으로 로테이션돌림
-겉으로 보이는 이미지와는 다른 강제잔업 및 눈칫밥생활
-타 대기업에 비해 턱없이 적은 연봉
-부서에 따라 근무강도가 넘사벽, 부바부 극심 워라밸 포기해야함
-사원들을 소모품으로만 생각하는 임원 마인드
-쓸데없이 자주하는 회식, 수직적 분위기
-내 삶이 회사에 맞춰지는게 아닌 내가 회사에 맞춰야하는 회사
-교대라면 제멋대로인 업무계획
-일하는 기계라는 생각을 많이 하게됬던 회사
-현장직으로 들어온다면 말리고 싶은 회사."
1,3,2,1,2,1,"꽤 괜찮은 복지
대외적으로 좋아보이는 문화기업이미지
다수의 계열사 보유","업무대비 매우 적은 연봉,
존중을 강요하나 존중을 받지는 못하는 문화,
주6일제+종종 주7일제
지리적으로 매우 시골에 위치
인력부족으로 매우 타이트한 스케쥴"
3,1,2,3,2,1,복지나 여건은 정말 좋습니다. 왜 여자들이 선호하는 기업 인지도 알수있음,부산공장 같은경우 정말 힘들었습니다. 퇴사율이 왜 그냥 있는게 아닌지 알수있음
3,4,2,3,3,3,"물론 부서별로 분위기는 케바케이지만 전체적으로 유한편입니다.
다만 제가 있던 데는 이끌어주기보다 개인적인 문화가 좀 강한 편이었던듯","이름대비 낮은 연봉 ... 가장 큰 문제
그리고 인력이 항상 모자르다보니 일이 많아 정신 없는것"
2,3,4,1,2,2,"복지및 할인카드 혜택 좋음. 계열사 다수 보유로 인해서,",회사 상주시간 길다. 대기업답게 삶의 많은 부분을 쏟아부어야 한다.
3,3,2,5,1,1,밥도 맛있게 잘나와서 점심때가 기다려진다. 업무의 강도가 그렇게 높지 않아 할 만하다. 통근버스가 있어서 출퇴근이 편리함,잔업이라든지 추가근무가 없어서 급여가 짠 편인 거 같다.
3,3,4,3,3,3,"복지는 갑. 부바부 지만 역량 또한 높일 수 있음
식품회사 답지 않게 미래 발전 가능성을 가지고 있음",비현실적인 경영목표에 좋은 사람들이 예민한 사람들로 변화 중
3,3,4,2,2,1,"뭐니 뭐니 해도 1등 식품회사, 시스템 탄탄하고 이상한 사람들 별로 없었음...물론 1990년대 후반 입사 선배들...많이 이상함",경영자 및 중간관리자들의 사고가 아직 1980년대...
3,5,5,4,5,3,글로벌로지속확장중. 수평적기업문화.업무로테이션이많아 경험쌓기최고,대기업치고는 다소높지않은연봉.다소강한업무강도.가내수공업제조방식도있음
