star,promotion,welfare,worklife,culture,ceo,merit,disadvantage
3,4,3,2,3,3,"다양성과 실생활과 관련된 재미가 있고, 투썸, 뚜레쥬르, 씨지비 등 임직원 할인 혜택이 많아서 실생활에 유용함","피피티 보고서에 너무 많은 시간을 쏟고, 남성적인 조직문화 분위기도 있음. 의사결정에 너무 많은 시간을 쏟는것 같음"
3,3,4,3,4,2,"대외적인 이미지가 좋다
최고의 신입 교육 시스템
다양한 복지와 직원들을 대상으로 하는 이벤트
자유로운 회식 문화","계약직의 입장으로 본 직원들은 일상적인 야근과 업무 스트레스에 시달림에도 불구하고
야근 수당조차 제대로 나오지 않음
대놓고 직원 판매를 강요하는 등 구시대적 문화가 만연하는 곳"
5,5,3,5,5,5,분위기가 좋습니다. 회식권유나 일반적으로 알고있는 군대식 문화는 아닙니다. 그리고 뭔가 체계적으로 업무를 배워나갈수 있는 기업입니다. 또한 결혼하고나서도 가정에 집중하는 것이 가능한 기업입니다.,사업의 특성상 연봉이라는 부분이 가장 단점이라고 생각됩니다.
3,3,3,3,3,3,브랜드 이미지가 좋고 많은 충성심 높은 고객들이 많다. 브랜드 인지도가 높기때문.,조직체게 보완할점이 많음. 특히 호칭문제.. 눈가리고 아웅하는편. 경영진들이 보수적인 마인드.
4,3,3,3,4,2,"나름 좋은기업문화만들려노력 (님문화, 자율근무제도입, 자율복장도입 등등..) , 괜찮은복지조건(가족과친구들이좋아함)",허리부분이없다 신입과오래된사람들 사이에 시니어가부족해 많은갈등을 야기
3,3,3,2,3,3,"업계 1위라는 자부심, 휴가갈때 콘도 이용이 가능하다, 다양하게 일을 접해서 다양한 지식 쌓기가 가능하다.",비효율적 문서 작업이 너무 많다.. 일이 너무 많다 워크앤라이프 밸런스 좀 신경 써주면 좋겠다
1,1,1,1,1,1,모든 씨제이 계열사 35프로 할인. 대외적으로 바라보는 시선,"중소기업보다 적은 연봉. 상여가 없음. 90년대식 기업문화. 생산직군한테 동아리활동, 프로젝트활동을 시킴. 지나친 회식 술문화, 퇴근후 나의 삶이없음 지나친 야근"
3,4,3,2,3,2,대기업이기 때문에 시스템이 체계적이라 많은 것을 배울 수 있음. CJ 직원 할인가에 구매할 수 있다는 점. CJ 푸드월드가 직원식당이라는점.,"쓸데없는 야근. 일이 너무 많다. 많은 업무에 비해서 보상은 적은편, CJ라고 하면 E&M의 분위기를 생각하지만 오산임. E&M의 제외하곤 삼성 같은 문화임."
4,5,2,5,5,5,"복지가 좋음. 실생활에서 느낄수있는 복지가 상당함!
여자가 많음.
먹을게 많음 ^^;;","짠 연봉.
사람을 마구뽑음(스펙잘안봄). 그만큼, 뽑아놓고 능력없다고 쉽게 팽당하는사람도 상당"
3,3,3,1,2,1,여성에게 특히 장점으로 보이는 식음료계열사 및 올리브영 35%할인 복지가 정점임 대기업에서 일한는 자부심과 깨끗한 근무환경.,"자유로울 것 같지만 생각보다 많이 보수적이며, 여성 리더도 적은 편. 근속년수가 그리 길지않고 업무강도가 센편이며, 야근과 주말출근도 잦은편임"
3,4,3,3,4,2,"출산휴가, 연차등에 대해 눈치보는 경우가 거의 없으며, 플렉서블 타임제 적용으로 출퇴근이 자유로움",일을 위한.일을 하는 경우가 허다하며 위로갈수록 실적압박에 시달리는 현상이 심해져 업무강도가 역피라미드 형태임
3,4,3,2,2,3,"다양한 복지혜택, ""님""호칭에 따른 수평적 문화, 철저한 성과주의로 성과에 따른 연봉 / 성과급 지급","지나친 성과주의, 과도한 목표에 따른 압박감, 오랜 전통을 가진 회사로 보고문화가 아직 남아 있음"
3,5,5,1,1,1,"높은복지(CJ카드, 호텔, 해외여행 등등)
성차별없는 평등한 조직문화
저년차 사원에 대한 많은 교육 프로그램
유동적인 직무 변환","상명하복 수직적인 군대분위기
영업 매출압박
본인이 근무하고 싶은 지역이 아닐 가능성이 높음"
3,4,3,3,5,3,기업문화가 좋고 수평적이며 씨제이 복지가 너무 좋음 다닐만 다니고 직원들을 위해 샤워장부터 참 잘 해두었습니다.,"월급이 적고 업무 환경이 좋지가 않습니다.
문화 기업답게 문화쪽은 화려하지만 식품쪽은 ..
환경이 그렇게 좋지가 않습니다."
4,3,4,4,3,3,"능력/성과에 따른 평가 체제.
임직원 전용 할인 카드.
여성들의 근무를 위한 다양한 혜택들. 성장을 위해 다양한 사업군 검토.","보고 및 결재 체계 복잡. 대기업중에서 적은 연봉.
회사 운영에 오너의 의견이 강하게 반영됨. 야근과 업무량이 아주 많은 부서들 존재."
3,4,2,2,4,3,국내 식품업계 리딩 기업으로서 거대한 브랜드들을 관리/개선함과 동시에 끊임없이 새로운 미래먹거리를 고민하고 있어서 관련 업계에서 가장 비전이 있는 기업. 또한 생활밀착형 기업이 많은 CJ계열사로서 다양한 직원 혜택이 쏠쏠.,내부 분위기가 결코 기대만큼 젊고 유연하지 않음. 전형적인 대외 이미지가 전부라고 생각하고 들어오면 큰 오산. 야근 많음. 칼퇴 적음. 계열사 할인으로 결코 만회할 수 없는 연봉수준. 젊은 직원과 부장/팀장급으로 구성 된 팀이 많음. 중간급의 이직이 많아서 그런 것으로 추정
3,3,2,1,3,3,인턴이라 대외비라며 업무를 거의 알려주지는 않지만 그래도 곁눈질과 눈치로 기업의 마케팅이 어떻게 이뤄지는 지 수박 겉햝기정도로 배울 수 있음. 정직원으로 일한다면 빠르게 마케팅업무를 배우고 성장할 수 있을듯. 업무량이 무척많음,인턴들에게는 정말 관심없음. 업무가 너무 많다보니 자기 업무에 치여서 인턴에게는 교육조차 거의 없음. 3명이 해야할 업무를 1명이 다 처리하다보니 야근은 필수. 한달에 두번 5시 반에 퇴근하라고하는데 걍 무시하고 야근함. 인턴은 전환율ㄹ 8-90프로라고 계속 교육하고 나중에 까보면 40프로정도 많으면 50프로.. 인턴이라면 걍 큰 기대안하고 회사에 대해 배운다고 생각하면 좋을듯 정직원이라면 잘 벼텨보다가 이직하기를
2,2,3,1,2,2,"네임벨류. 복지포인트.
돈이 안드는 일에 관해서는 업무 처리가 잘 되는 편.","단순 보고를 위한 문서 작업이 본 업무 보다 중요시 되어 비효율적.
체계가 복잡하고 일 처리가 원할하게 이루어지지 않음.
탑다운 업무처리 많음.
대놓고 강요하지 않지만 야근해야 하는 분위기. 회식도 마찬가지.
야근 비용, 회식 후 교통비 등 없음.
연구개발직임에도 불구하고 연구비용에 굉장히 민감하고 까다로운 편."
3,3,3,3,3,3,복지 측면에선 좋은 점도 물론 많다 회사의 분위기 쇄신을 위한 노력도 조금은 보인다,연봉이 동종업계에 비해 낮은편이다 본업보다 보고업무사 많은느낌이다 야근과 주말근무가 잦다
3,3,3,2,3,3,업계 1위라는 자부심으로 일할수있으면 직무변경도 비교적 용이함,딱딱한 분위기와 보여주기식 근무 등의 태만한 사내분위기
3,3,3,4,4,3,복지가 실 생활과 연결된 복지가 많아 좋음. 기업문화도 젊음. 여성이 다니기 좋은 회사임,연봉이 대기업 치고는 많이 낮음. 복지가 좋은것응 사실이나 연봉이 낮아 복지라도 있어야할것같은 느낌.
2,2,2,1,2,2,"큰 사고 안치면 잘리진 않음.
공채들은 다닐만함.
식품업계 1위 자부심..","보상대비 업무량이 많고, 잘하는사람에게 일이 몰림.
그에따른 보상은 모르겠음."
3,4,4,3,4,3,식품업계 1위의 자부심이있고 복지 탄탄 배울수있는게많다,기업의 수직적인문화와 배울건많다 왜냐? 일이많으니까 꼭 목표를 달성해야함
3,3,2,1,4,2,님문화로 욕설 및 폭언이 없습니다. 식품 최고 회사라는 자부심을 가질수 있습니다.,"일단 대기업에 비해 연봉이 낮으며, 인력이 부족하여 야근이 많다. 또한 회사가 직원들에게 투자를 하지 않는다."
3,3,3,2,1,1,계열사 복지 연계성이 좋고 타사에 비해 상대적으로 구성원들의 됨됨이가 좋다,비효율적인 의사결정 경직화된 분위기 임원들의 자기반성이 부족
4,3,4,1,2,2,"정말 많은 일들을 경험해 볼 수 있으며, 내가 사장이라는 마인드로 일 할 수 있게 해주는 분위기, 그만큼 책임감이 필요함.",끝이 없는 보고와 일. 겉에서 보는 이미지만 생각하고 간다면 후회함.
5,4,3,3,4,3,"프로세스와 체계들이 잘잡혀있음
리딩컴퍼니로서 식품업계의 트렌드에 항상 앞서 나간다",그만큼 근무강도가 쉽지는 않다 야근강요하지는 않지만 자발적으로 하게 됨
2,4,4,2,2,4,연차를 마음놓고 사용 가능 선배들의 빠른퇴사(근속연수가 적음) 으로 인하여 빠른 승진기회 복리후생,고졸출신 상사들로 인한 군대마인드 잔류 젊은 사람들은 오래버티지 못해 일의 과중 일에비한 돈은 적음
4,4,2,2,3,3,본인이 원하면 배움의 기회가 많다. 업무량이 많아 일을 배우기가 좋다.,"보수적인 분위기, 상사에 따라 퇴근 눈치를 봐야 하는 부서도 있다."
5,4,3,4,3,2,칼퇴가능 하지만 본인의 능력에 따라 하는거고 사람들이 좀 냉소적인 면이 있지만 그래도 일의 분담이 정확하여 따로 터치를 하진 않음,보고서나 자료 작성이 많아서 늘 수치를 보여주고 관리해야함 팀장이나 윗 분들이 너무 빨리 출근하셔서 좀 불편했어요
3,4,3,5,3,3,복지가 좋고 식품업계 부동의 1위로 성장가능성은 매우 높다,워크앤 라이프 밸런스를 맞추기가 어렵습니다 휴가도 쓰기 어려움
3,2,3,1,3,3,정성 정량적으로 많이 배우고 논리력과 설득력을 깆춘 마케터로 거듭남 이직해서 이쁨받을수 있는 지식과 태도를 갖게됨,"자기주장이 약하면 잘모른다 생각함 능력 인정받기위해서는 부단한 노력과 운이 필요함
어릴때부터 정치해야함"
4,3,2,1,3,3,전문성 기르기에는 나쁘지 않음. 단 부서별 편차는 꽤 심한 편.,목표를 향해 전 구성원이 열심히 달려나가야 하지만 무임승차자가 많음.
3,2,2,2,2,2,"복지가 좋고, 기업 문화가 자유로운게 좋은 것 같습니다",푸드코트 가격이 비싸 식대에 있어 지출이 심한 편이라 아쉬움.
5,5,5,5,5,5,"복리후생이 자잘하게 잘 되어있다. 특히 숙박과 여행지원에 대하여 지원이 잘 되어 있고, CJ계열사 할인이 좋다. 분위기가 유연하여 트러블이 많이 없다. 앞으로의 성장가능성이 좋다.","초봉이 낮은 것이 가장 큰 단점이다. 연봉상승률은 자기의 능력과 팀의 성과가 좋으면 다른 대기업과도 크게 차이가 나지 않지만, 힘들다는게 문제이다. 성과제도지만 사람이 평가하므로 진급에 대해서 객관적인 판단이 힘들다."
3,3,2,3,4,3,"연차사용이 좋다 기업에 이미지는 좋다
부서이동이 자유롭다","복지제도가 다양하지만 돈이 많이주는게 최고인듯...
노후된설비가 많아 투자가 많이 필요함"
3,3,3,3,3,3,케바케지만 사람들이 전체적으로 좋다. 부서원중에 모난사람이 없음,연봉..연봉..연봉.. 엔지니어치고 연봉이 작다. 다른 친구들 말 들어보면 정말 차이많이나는 편인것같다
2,2,3,3,1,2,"부서별 업무강도는 상이하며, 철저하게 고과제이기 때문에 직장상사에게 잘보이는게 중요시 됨.",공장이 오래되어 여기저기 문제가 많아 노동력이 많이 요구됨.
3,3,2,2,3,3,"업계 1위, 식품산업의 안정성, 다양한 복지 혜택(임직원 할인)","보수적인 기업문화, 높지 않은 연봉, 야근 및 반복적인 업무 많음"
2,2,2,1,2,2,생활문화기업답게 임직원카드로 할인받을 수 있는 혜택이 제법 쏠쏠,1등기업의 1등답지못한 기업문화가 존재하는듯한 느낌. 열악한 시장환경을 헤쳐나가기란 정말 쉽지않다.
3,3,4,1,2,3,국내 No.1식품기업으로 소재부터 가공식품까지 사업을 하고 있어 식품 산업 전영역에 대해 경험을 쌓을 수 있음. 대기업으로 프로세스가 잘 구축되어 있으나 분석 업무가 많아 업무량이 많고 쉽지 않은 회사,다양한 식품군에 성과중심으로 일하다 보니 모든 일이 단순하게 진행되지 않고 기간계 업무 부서의 영향력이 크다. 상대적으로 마케팅이 중요하게 생각되지만 영업과 기획팀이 모든 사업을 주도한다고 보면 될 듯함
3,3,4,2,4,1,"오랜 역사로 기업체계가 안정적이고 조직문화가 반듯함
정직한 문화, 학벌 지연 없고 노력이 인정받는 분위기 좋음","보고를 위한 보고, 지극히 관료적인 문화, 조직이기주의로 내부갈등 팽배"
4,4,4,5,4,3,식품업 1위라는 장점과 무엇보다 cj 복지혜택을 누릴 수 있는 것이 큰 장점,야근이 굉장히 많은 편이다. 특히 매장 내 여사님들과의 갈등도 상당하고 실적 압박이 상당한 편
2,3,3,3,3,2,복지가 좋음.복장 자유로움.부서별로 다르지만 야근이 심하진 않은편. 술 강요하지 않음,생각보다 보수적이고 부서별로 다르지만 여자가 많아 은근한 신경전.근속년수 짧음.타 대기업에 비해 연봉 낮음
1,2,2,1,1,1,"35% 할인, 기업의 대외적 이미지로 인한 지인들의 인정","1. 실적압박 엄청 심함, 전년비 신장했음에도 불구하고 경영계획에 한참 못미침
2. 보여주기식 업무가 과다함. 사진으로 인증하거나 취합해야 하는 업무가 대다수
3. 내근과 외근의 콜라보. 외근하면 내근이라도 적어야 하는데 내근도 많음
4. 차량이 지급되지 않으나, 곧 GPS가 달린 차량 지급예정. 무서움
5. 업무강도에 비해 페이가 적음. 시급 만원도 안됨.
6. 항상 성수기임. 바캉스철, 명절, 김장철, 매실당철 등등.
7. 갑작스러운 매장지원도 존재. 주말에 쉬다가 불려나갈수도 있음.
8. 회사가 가진 목표를 주입시킴. 말도 안되는 것을 되게 하라고 사람을 쥐어짬. 참기름될뻔"
4,5,4,4,3,3,"석식을 무료로 제공한다. 야근이 생각보다 적은 편이다. 주말근무는 잘 없다. 케바케지만 전반적으로 최근은 그렇다.
복장이 다소 편해지고 젊은 사우들이 많은것도 장점이다.
전국 및 해외 거의 모든 호텔에 혜택이있다. (복지)
거의 모든 계열사35프로. 정말 좋다. 특히 올리브영과 올리브마켓 장볼때 최고다. (엄마가 좋아한다)","중간관리자가 많이 없다. 경쟁이 치열한 분위기. top down으로 의사결정 되어 내려오는 일이 많다. 실무자들은 큰 권한이 없다.
잡무가 정말 많다. 불필요한 일들이 30%는 되는듯하다.
일을 위한 일..."
3,3,2,2,3,2,실생활과 연관된 복지혜택과 비지니스캐쥬얼이라는 편한 복장. 그리고 연차 사용이 자유롭다.,누구나 알만한 사실이지만 근무강도가 꽤나 강하며 그에 비해 턱없이 부족한 급여가 가장 큰 단점이다.
4,5,4,2,4,3,1위기업의 자부심 씨제이그룹이라는 그룹차원의 탄탄함과 복지,출근시간은 있으나 퇴근시간은 정해지지않음 과도한 업무량 실적압박은 당연한것
3,3,4,2,4,2,"고과에 따른 천차만별의 연봉, 해외여행서비스등 복리후생이 좋고 외부에서 선호함",하루 13시간 이상의 근무와 마케터에게 부여되는 지나친 책임과 역할
2,3,2,2,5,2,국내1위 생활문화기업 기업이미지등이 장점 여자가 많아서 부드러운분위기?,살인적 근무행태 복지부동 윗사람들 조직문화 살짝 여성우대 분위기
3,4,3,2,3,3,"스펙에 한정되지 않고 열린 인재를 뽑는 느낌
회사 규모가 식품회사 1등이라는 자부심과 다양한 직무 경험 가능.","익히 알려져 있듯이 일이 너무 많음. 연봉은 식품업계에서는 최고수준이지만
일량에 비례하면 적은 느낌.
지방 공장 분위기는 그냥 중소기업이고 호칭도 옛날 방식을 쓰고, 보수적인 남성중심 집단. 고졸 출신 상사들이 많아 분위기가 대기업답지 않음."
4,4,4,4,4,4,"수평적 기업문화이며, 누구나 님이라는 상호존칭을 쓰고 있고, 자유로운 의사 토론을 할수 있음. 워라벨을 원한다면 본인의 의지와 능력 여부에 따라 실현할 수 있음.","수평적 문화이지만 공장은 공장 나름의 특성에 맞추어 업무가 재분배 되며, 형님 동셍문화를 원한다면 본인의 적극적인 노력이 필요함"
3,3,4,3,4,2,"부서마다 다르지만 대체적으로 수평적인 문화
연차가 적어도 많은 권한을 가지고 업무를 할 수 있음","보고를 위한 보고, 비효율적 문서 작업이 과다함
단기 성과 위주 업무 평가 및 의사 결정"
3,3,4,3,4,3,시스템이 좋아 초년생들이 배움을 얻기 좋으나 올라갈 수록 치열함,"보수적이고 수직적인 문화가 존재함
보고가 많고 일을 위한 일이 존재함"
3,4,2,3,2,2,본사건물은 깔끔하고 시설도 좋음. 생활문화기업이라 관련된 사업영역에 대한 복지가 좋음. 요즘은 조직문화 개편에 대한 노력이 있는듯,공대생한테는 비전이 없고 나이든사람들이 실무자들을 쪼아서 성과를 만드는 회사라 발전이 안됨. 부서마다 워라밸의 차이가 매우 심하며 먹고 살만큼 주는 연봉은 어쩔 수 없음. 불필요한 보고방식 및 업무 방향
3,3,3,2,3,3,자율적인 분위기로 자신의 업무에 몰입해서 일할 수 있는 분위기임.,업무량이 많은 편으로 가끔씩 주말에도 출근을 해야하는 경우가 있음.
4,4,4,2,5,4,복지는 어마어마하다 여성의 경우 손가락에 꼽을 정도로 다니시 좋은 회사,사업장 특유의 분위기에 따라 일의 고하가 결정 됨 인천의 경우 자재관리는 90년대식 일처리 방식으로 업무의 가중화로 잦은 야근
3,2,2,5,1,3,"복지가좋고 자동화시스템이 잘갖춰진 사업장들이있다.
계속해서 발전하고있다.",불합리한 인사고가평가.군대식문화. 연봉은 낮고 일강도는 엄청남
3,3,4,3,3,3,깨끗한 환경과 대기업다운 복리후생이 있었다. cj계열사의 할인혜택도 좋았다.,너무 단순한 직종이라서 자기계발이어렵다. 매일매일하는 생산업무라 피곤하고 박스를 만드는 일이기에 연봉은좋지만 젊음을 빼앗기는느낌
2,4,3,1,4,2,"기념일에 CJ상품권이 나왔고, 구내식당 음식이 맛있었으며, CJ임직원 혜택으로 계열사 30% 할인카드가 나왔던 복리후생이 괜찮았던거 같습니다. 또한 파격적인 호칭 예를 들어, 직급을 빼고 '~님'으로 부르던게 기억에 남습니다. 무엇보다 R&D에 지속적인 관심이 있어서인지 새로운 사업이 계속 시도되는 점에서 비전이 있습니다.","지방 식품공장에서 생산관련 직군으로 일했었는데 본사는 어떨지 모르겠지만, 뉴스에 식품관련 이슈라도 터지면 집에 가는게 어려울정도였고, 업무 강도에 비해 불필요한 야근이 많았던거 같습니다."
2,2,4,1,3,2,관리 시스템 및 업무가 체계화 되어있다. 복지가 다양하다.,박봉. 바꿔야한다면서 그대로 남아있는 군대문화. 과중한 업무 등등
2,2,3,1,1,1,"그룹사 35% 할인, 창립기념일 휴일, 공채끼리 끈끈한 정이 있음","남여 역차별, 경력직을 많이 채용하며 승진 및 커리어 불이익, 암묵적 야근 강요"
3,3,3,2,4,3,님 문화로 통칭되어 잘 알려진 수평적 문화가 소속된 사원들의 자부심이고 또 성장동력이 되고있다.,아직까지는 대기업이 가지는 특혜와 보수적이고 고지식함을 완전히 떨치지 못해 젊은 기업 문화와 그 구성원에 비해 더딘 성장
2,2,3,3,1,3,식품1위업계. 대기업제조사 다운 다양한 품목에 1등 브랜드가 많음. 임직원할인 35% 가능. 까페테리아 포인트를 이용해 여러 문화및 여행을 즐길 수있음,마케팅과 대형할인점 중심. 다소 타 채널은 소외받음. 공채문화 아직 존재함. 업무의 실현성 보다는 보고 중심의 문화. 개인의 능력보다는 조직의 정치에 따라 좌지우지됨
3,3,3,3,4,3,"계열사할인율, 해외여행숙박비류 지원, 여성의 성비구성 높은 편으로 상대적으로 조금은 더 수평적분위기 조성되어 있음","대기업 대비 낮은연봉, 생각보다 계열사간 이동확률은 낮고 올라갈 수 있는 기회가 적음, 신입은 많이 뽑는 편이지만 중간급의 이탈이 많고 암묵적 권고사직 등 근속수명 짧은 편"
3,3,3,3,3,3,"탄탄한 기업, 내수뿐만아니라 지속적인 글로벌화로 회사가 무너질것같지않다.
상여금없이 통상임금으로 잔업시 돈을 많이벌 수있다","씨제이란 이름값에비해 연봉이라던지 환경이 좋지못하다.
사업장마다 차이가 있겠지만 오래된사업장같은 경우 환경이 열악하다."
2,4,2,1,1,1,"마케팅 직무는 신입때부터 다양한 업무 경험을 쌓을 수 있음
비용집행부서라 영향력을 크게 행사할 수 있음
복장은 비교적 자유로운 편","마케팅은 야근이 정말 많음
보고를 위한 보고가 많음
매출과 손익으로 엄청 쪼임"
3,3,3,1,2,2,복지하나는 인정 워낙에 계열사가 문화콘텐츠와 외식사업 헬스뷰티등 다양하게있어 할인이 많이됨,"여기서 일하는 분위기
완전 군대문화 수평적인 문화를 만들려고하지만...글쎄...
아부잘해야하고 윗사람한테 잘못보이면 끝 특히 팀장한테
그리고 퇴근시간은 거의 밤9시이고 주말 보장x"
3,3,3,3,3,3,"임직원 복지포인트로 국내외 호텔 이용가능, 올리브영 투썸 등 CJ계열 할인","낮은 연봉,노조없다고 봐야함, 유연하다고 하나 그렇지 않은 부분도 있음"
1,3,2,1,3,2,"워커홀릭에게 좋은 회사, 계열사 할인, 여성에게 많은 혜택, 동종업계 1위, 외부적인 이미지","야근수당 없음, 많은 업무량으로 인한 주말 반납, 제조업 치고는 공장 대우가 형편없어 공대생에게 비추천, 계열사 복지를 제외하면 크게 와닿는 복지 없음"
3,3,2,2,2,3,인프라구축및시스템이좋아 배울게많음 아마 cj계열사 대부분은 비슷함 제일제당과 이엔엠이 선두로 기업나 문화 혁신중.,"살인적인 근무강도와 낮은복지, 연봉이 다른 대기업에 비하여 낮고 아직 기업문화혁신(복장자율화 패밀리데이 퇴근 등등) 은 대외적으로만 실행중이고 대부분 지켜지지않음"
4,3,4,1,2,3,"1.복지혜택
2.기업이미지
3.다양한 유관부서와 연결 되어 있는 체계적 업무프로세스","1.지역사업장 주변환경 열악
2.챌린지 문화가 변질되어 책임떠넘기기가 많음.
3.근무지이동 , 직무변경 어려움
4.야근수당 주말출근이 너무 많고, 주말,야근수당은 그만큼 못받음."
3,3,2,5,2,3,식품업계 1등 의 자부심과 글로벌 사업에 대해 경험할 수 있는 기회가 많음,"업무 강도가 정말 강해서, 부서마다 다르지만 일과 삶의 조화는 사실 기대하기 힘듬"
5,5,5,4,2,5,복지가 너무좋다 (해외여행 35프로 지원 제휴호텔 지원 계열사 35프로 할인등),매우 보수적이다 대외적으로 봤을땐 진보젓이고 젊은 분위기일것같지만 전혀 그렇지않다
4,3,4,2,4,3,네임벨류.. 수평적인 문화 그리고 소속감이 강하게 든다.,비교적 작은 연봉과 은근 일이 많아 오래 일할수있을지 의문
4,4,4,4,4,4,Cj만의 문화 열린문화 수평문화 님문화 토론방 등 서로를 존중할줄 아는문화 기본적으로,"업무량이 .. 솔직히 좀 잇는편임
그래도 대우와 복지를 생각하면은 충분히 감당할수 잇는
부분이다"
2,3,5,1,2,2,다른기업보다 복지혜택은 좋음 씨제이 계열사 35% 프로 임직원할인으로 많은 혜택을 받을 수 있고 일년에 다여섯번씩 이엔엠에서 만든 영화표 줌 그리고 대외적인 어른들이 보는 기업이미지가 좋음,무조건 아침마다 회의하고 직원들에게 강요하는 문화가 많음 부서마다 다르겠지만 그리고 특히 결산때는 초죽음 여자라도 밤새기 일수임 쓸떼없는 페이퍼보고와 여러버전의 양식으로 자료를 필요이상 많이 요구함 부사용 제당용 지주사용 같은 데이터로 기본 세개이산 보고서 작성해야함
4,4,3,3,4,4,"목표를 가지고 열심히 일하면 인정받을 수 있고 배울 수 있다.
자유로운 근무환경",불가피하게 야근을 해야하는 경우가 많기 때문에 워크앤라이프 밸런스가 단점이다.
