star,promotion,welfare,worklife,culture,ceo,merit,disadvantage
3,3,4,4,4,3,"그린팩토리 건물을 비롯한 복지가 좋다. 낮잠 잘 수 있는 공간, 점심시간에 북적이는 사내 카페 등. 9시 출근. 일을 마치면 퇴근 시간도 자유로운 편이다.",생각보다 단순 노동이 많음.부서 간 이해관계가 달라서 갈등이 있음.
4,3,3,4,4,3,팀 분위기가 좋고 근무환경과 사원복지가 잘 되어있다. 여성직원이 근무하기 좋은 환경. 팀내 강압적인 분위기가 적음,새로운 시도의 부재. 물론 개인 역량에 따라 다르나 개발자로서는 약간 제자리걸음하게 될 수 있는 환경.
4,3,3,3,3,3,"여유로운 분위기, 좋은 복지시설, 값싼 커피값, 자유출퇴근제","실력위주, 교육없음, 생존경쟁, 인재를 찾기보단 도구를 찾는 느낌"
3,3,4,4,4,3,약 3개월 정도 인턴으로 근무했는데 전반적인 기업 분위기는 자유롭고 수평적인 조직문화를 느낄 수 있었습니다. 직원 복지 역시 좋았고 워크 앤 라이프 밸런스도 괜찮아보였습니다.,현직자에게 아직은 중견기업이라 그런지 신입사원에 대한 교육이 체계적이지 않은 것 같다는 의견을 들었습니다. 사내 많은 사람들이 경력직으로 채용되었고 회사에서도 경력을 원하는 것처럼 보였습니다.
4,4,5,4,3,3,비교적 자유로운 분위기와 성과위주의 치열한 분위기가 공존하는 상태. 온라인분야에서 가장 선도적인 기업으로서 적절한 유연함속에 체계적으로 업무를 배울 수 있음,잦은 조직개편. 상위의사결정자와 직원간의 큰 괴리감. 관리자나 동료를 잘만나면 실력을 쌓을 수 있으나 그렇지 못하 상황에서는 함께 가기 힘듬
3,3,4,3,3,2,"높은 복지 수준과 괜찮은 연봉, 대외적으로 괜찮은 이미지. 업계 1위인만큼 거의 전국민이 쓰는 서비스를 직접 다루는 경험을 할 수 있는 기회.",팀 바이 팀이 심함. 대외적 이미지와 달리 수직적이고 답답한 의사 결정 구조. 신입으로서 제대로 된 교육을 받고 체계적으로 성장하기에는 구성원 교육에 회사가 별다른 신경을 쓰지 않는 느낌.
3,3,3,4,3,3,"전국민을 대상으로 서비스를 직접 기획할 수 있는 기회, 잘 된 서비스를 잘 유지하는 것도 좋음","잘 하던 것을 더 잘 하기가 어려움, 서비스의 포화상태"
4,4,5,2,4,4,퇴사하면 안다. 얼마나 훌륭한 사람들과 함께 일했는지..밖에서는 절대 못 만난다.,승진은 자기 하기 나름이지만 부장 승진부터는 정치 놀이가 작용.. 그리고 30대 중후반이 되면 살길을 찾을 수 밖에 없다.
4,4,3,2,3,3,포탈업계 1위 기업으로 국내에서는 IT 탑의 기업 개발하기 좋은 회사,"왠지 눈치보이는 자율출근과 필연적인 야근, 건강 염려"
4,2,4,4,4,2,샤워시설. 동아리활동. 구내식당. 통근버스 등 일에 집중하기에는 괜찮은 환경입니다.,경력직만 뽑다보니 서로 의견이 부딪힐때가 있고. 수평적인 문화라고하지만 서열이 존재합니다.
4,4,4,5,4,4,각 랩별 분위기마다 상이하지만 대체로 할일만 끝내면 칼퇴가능. 야근이 있을 때도 있지만 수용가능한 이유. 자신의 능력이 있다고 판단되면 적극추천. 애매하다면 글쎄. 페이쪽이 점점 잘되고 있는듯.,인력을 키우려 하지 않는다. 이미 검증된 인재(경력)를 선호하는 경향. 웹쪽에서의 이익의 창출이 더이상 힘들어 보임(기존 수익구조에서의 발전을 의미).
4,3,4,2,4,3,"대량의 데이터와 트래픽을 경험해 보고 싶다면 고!
내가 만든 서비스가 커 가는 것을 보고 싶다면 고!
아직까지 배울 것이 많다는 것을 느끼고 싶다면 고!","조직이 큰 만큼 업무외의 스트레스를 받는 경우가 종종 있음.
조금만 뒤떨어지면 바로 티가 남.
업무 강도가 만만치 않음. 개인 시간에 대한 욕심은 조금 버리는 게 좋음."
3,3,5,3,4,3,복지가 좋고 아침도 주고 밥도 잘나오고 모든게 전산화 시스템. 업무 외에 여러가지 컨퍼런스나 교육활동의 기회가 많다. 야근도 많지 않고 개인시간 가지기에 좋음,자신만의 디자인적 역량을 펼칠 수 없는 환경. 여러사람이 일을 잘게 나누어 가져서 디자인하기 때문에 좁은 영역만 배울 수 밖에 없음
3,4,4,2,3,2,"복장 편하고 퇴근 눈치 없고 복지 좋음
줄만 잘서면 큰 인센티브 가능","수시로 진행되는 조직개편으로 우왕자왕
최고위층의 말한마디로 업무 수시 개편
조직장에 따라 평가 천차만별"
4,3,4,4,4,4,IT쪽 최고의 개발자들과 함께 일할 수 있다. 연봉이 높고 은행에서 대우 해준다.,"수시로 조직 구조가 바뀐다. 계약직, 파견직과 정규직의 급여 차이가 크다. 파견직은 인센티브도 없었다."
4,4,4,5,4,3,개발의 경우 불필요한 야근이 많지 않음. 거의 대부분 협업하기 크게 무리없는 수준의 동료 혹은 협업직군. 수직적 수평적중에서 굳이 고르라면 수평적에 가까운 분위기.,단점은 크게 없지만 굳이 꼽자면 연봉이나 연봉 상승률이 대기업이나 유수 외국계 기업에 비해서는 낮을 수 있음. 라인이 분사하면서 네이버의 성장성이 둔화.
3,3,3,3,3,3,시설 좋음. 밥 맛있음. 위치 좋음. 주변사람들에게 좋은 인상. 자유롭고 개인적인 분위기,팀마다 다르겠지만 그렇게 분위기가 좋지는 않았음. 보여지는 이미지만큼 자유롭기만 하지는 않음
3,3,3,3,3,3,다양한 직군과 여러 백그라운드를 가진 사람들 속에서 커리어를 발전시켜볼 수 있음,점점 대기업 문화가 스며들면서 작은 조직이 가지는 특유의 민첩함과 생기를 다소 잃어버린듯한 느낌이 듬
5,3,4,3,3,4,"국내 1위, 네임벨류, 좋은복지, 능력만 좋으면 보상확실","잘 느끼지는 못했지만 정치가 심하다고 함.
엄청 빡시다."
3,3,4,2,3,3,"근무하기 좋은 건물, 부모형제까지 커버되는 실비보험 등의 복지가 가장 큰 장점이라 생각합니다.",외부의 변화를 보지 못하는 우물 안의 개구리가 될 확률이 높은 곳입니다.
3,2,4,4,4,1,"잘 알다시피, 최괴의 복지를 가지고 있는 회사임, 연차를 눈치 안보고 쓸수 있으며 책임 근무제라는 유연한 출퇴근제를 실시 하고 있어~편리함 점이 많음. 여자들 에게는 준공무원에 가까운 최고의 회사일 것으로 생각됨","신입 일 경우 배우는 점이 많아서 좋긴 하지만, 첫 회사일 경우 나쁜 습관을 갖게 되어 앞으로의 인생 회사 생활에 매우 나쁜 영향을 미칠것으로 보임"
4,3,4,3,4,2,"자유로운 분위기, 좋은 환경, 복지, 임금
건물나 사무실의 환경과 비품 등이 좋다.
복지 혜택이 많다.","성과가 중요한데, 평가가 애매함.
성과에 따른 임금 차이가 매우 심하다.
야근이 많을 수 있다."
4,3,4,4,4,3,복지나 근무환경 구성원들의 전반적인 수준 등 일을 하기에 좋은 환경,향후 미래에 대한 방향이 보이지 않는다 너무 비대해진 조직
3,3,3,3,3,3,사내문화와 분위기 복리후생 다 좋습니다. 탄탄한 기업인 만큼 일도 많이 많이 배워갈 수 있고 이직하기에도 좋은 직장입니다.,근로시간에 비해 연봉이 적은 느낌입니다. 하지만 큰 단점들은 별로 없는듯. 커버 가능함.
3,3,4,3,3,2,좋은 업무 환경과 복리 후생 충분한 성장 가능성이 있는 업무 와 커리어,일사분란한 대기업의 체계와는 달라 다소 느슨하고 개인적인 협업 환경
4,2,4,3,5,4,"sw 개발 경험을 쌓기는 최적의 회사. 다만, 실무능력이 없으면 견디기 어려움. 실무를 수년간 쌓고 그런 경력을 탐내는 회사가 많기 때문에 이직은 쉬운 편임.
복지수준이나 회사 시설은 국내 top 규모임.
30대 중반까지는 무난하나 그 이후부터는 한계를 느끼게 됨. 그 이후부터 연봉 인상율이 국내대기업대비 낮아짐.
30대 중반까지 실무경험을 쌓고 그 이후부터는 국내 대기업이나 스타트업 chief 자리로 이동하는 케이스가 무난해 보임.","자율근무제이긴 하지만 사실 눈치 안보고 쓰긴 어려움. 대부분의 신규 서비스등이 상향식이 아닌 하향식으로 내려옴. 하지만 하향식으로 내려온 경우에 별다른 임원설득 작업은 불필요해서 실무만 집중할 수 있는 장점도 있음.
다른 복리수행 대비 교육비 지원이 없음.
인센티브가 개인의 1년 평가와 연계되어 있고 비율고정식 상대평가라 억울하게 소득이 줄어들 수도 있음."
2,1,2,1,1,1,인터넷 업계의 브랜드 파워를 느낄 수 있는 곳으로 해당 직종의 네트워크 형성에는 최강인 곳.,"대기업 출신 인사 담당자들의 유입으로 벤쳐기업 정신이 말살되었고, 특정 대학교 파벌이 생겨 성장의 기회가 줄어들었음."
4,3,3,3,3,3,"수평 문화, 협업, 개발자에게 최고다.
최근 주춤하고 있지만 개발 문화나 복지가 좋았다.","단점은 솔직히 잘 모르겠다. 정말 팀에 따라 케바케인듯..
서비스 사업이 정체인듯 하다"
3,3,3,3,3,3,직원들 분위기가 괜찮음. 다들 왠만하면 소리치지 않으려고 노력하는 분위기.,다소 보수적 분위기. 눈치를 많이 봐야해서 피곤할 수 있음.
4,4,4,4,4,4,"진정한 자율 출퇴근제, 일정이 지나치게 타이트하지 않아 품질관리하며 개발할 수 있는 환경",최근 시도하고 있는 서비스들이 표절 시비에 휘말리는 경우가 잦은 것 같다.
4,4,4,3,4,4,직원을 위한 여러가지 복지. 적당히 높은 연봉수준. 능력있는 팀원들.,대기업과 벤처기업의 분위기가 공존. 장점도 되고 단점도 될 수 있는 부분.
3,3,4,3,4,3,개개인은 능력있거 젛구녀. 복지랑 자유로운 분위기가 젛아요,중간 간부 이상이 다 위의 태양(이해진 의장) 만 바라보고 있다
5,3,5,4,5,2,"자율 출퇴근, 주변에 능력있는 사람들이 많다. 사옥의 인테리어나 환경이 좋은 편이다.",결국에 대기업이기 때문에 존재 할 수밖에 없는 프로세스들이 있는편이다.
5,4,4,4,4,2,개발과정이나 서비스회사의 운영을 배우기 좋은 회사 실력있는 동료들이 많다. 이직을 해보니 좋은 회사였다는걸 새삼 깨달음,라인따라 가는 성과와 야근 강요등 점점 더 안좋아지는 분위기
4,3,4,4,3,3,의료보험을 비롯한 복리후생과 다른 회사에 비하면 자유로운 분위기,기업이 커지면서 수직적인 문화가 뚜렷해지는 추세가 있음
4,2,4,4,3,4,"명실상부한 1위 기업, 자유로운 분위기, 수평적인 조직, 사내 복지 등 장점이 많음.","무능력한 경력직이 다수 있어, 오히려 모티베이션에 방해가 됨. 경력직으로 입사하는 것은 좋으나, 신입으로 입사한다면 성장 가능성에 의문을 품게 될 것임."
4,3,4,3,3,4,복지가 좋은편이고 외부에서 보이는 이미지도 좋은편이다. 실력있는 분들이 많아서 배울수있는 부분이 많다 또한 그들과 추후에 같이 네트워킹하여 좋은 인맥이 될수도 있다는것은 장점이다.,큰 회사라서 그런걸수도 있는데 업무자체가 프로젝트의 작은 일부분을 해야하는 경우가 많다. 업무 진행이 느린경우가 많고 조직 자체가 크다보니 타 부서와의 커뮤니케이션이 쉽지 않는 경우도 많다.
3,3,4,3,3,3,업계 최고 대우 IT분야 우리나라 최고 회사. 자유로운 분위기라 근무 환경도 좋음. 업계 전반에 대해 파악 가능,의외로 보이는게 다가 아니라는 생각이 들었음. 업계 최고인 만큼 스트레스도 받음
4,2,4,2,2,2,연봉을 많이주고 네이버라는 이름빨이 있어서 다닌다는 자부심은 있었다는 거 같다.,"온실속의 화초가 되는게 아닐까 하며, 자기계발에 도움이 되지 않는듯 하다."
5,5,5,3,5,4,"복지굿. 창의성 자율성 굿
자유로운 의사표현과 승진기회","잦은 조직개편과 다양한 업무. 업무강도는 쎈편
긴장감있고 책임을 주어지는 일들"
4,3,5,3,4,3,"많은 사용자와 동접을 처리할 수 있는 시스템을 개발, 운영할 수 있어서 기술을 배우고 경험을 쌓기에는 좋은 회사",경영진의 관심이 라인으로 이동한 상태에서 서비스가 정체되어 있고 신규 서비스 개발이 없음
4,2,5,5,5,4,업계 최상위 수준의 복리후생과 스스로 관리하고 책임지는 근무환경,사원의 직책이 없고 팀장 실장제 폐지로 실질적인 직장인으로써의 승진에 대한 성취감이 떨어짐
3,3,5,3,4,3,1위 기업인만큼 자부심을 느끼면서 다닐수 있음. 보수도 좋은편,복지는 좋은데 은근히 근무시간 많음. 잔업 야근...
3,3,3,4,4,3,복지도 괘안코 아직까지는 1위. 그러나 앞으로의 엄혹한 상황은 어찌될지 모름,"사내 정치 대박, 점점 보수화되는 기업문화, IT환경 변화에 따른 위기감 증폭중"
4,3,4,4,4,3,"국내 1위 인터넷 기업으로 다양한 복지, 근무 환경과 실력있는 동료들을 만날 수 있음","회사가 커지면서 점차 대기업화 되고있다. 불합리한 야근을 강요한 적이 있고, 창업자의 말 한마디에 좌지우지되는 모습"
4,3,4,2,4,3,좋은 인재들이 많음. 배울것이 많음. 다른 회사에서는 경험해보지 못하는 자체 서비스를 다룰수 있음.,정체기에 빠져든것같음. 관료화 되가고 있음. 잉여 인원에 대한 관리가 필요함. 무조건 자르는 것보다 적당한 동기부여를 통해 최대한의 성과를 끌어내기를 기대.
3,1,5,2,2,1,"국내 인터넷 1위 기업으로 복지가 좋다
수익모델이 안정화되어 있다","정치력이 좋지 않으면 기회가 오지 않는다
시키는 일만하며 다녀도 만족한다면 괜찮은 회사"
4,4,4,2,2,4,"일하기 좋은 사내환경(사내식당, 조식, 카페테리아, 도서관, 그 외 업무환경 등), 괜찮은 보수","과도한 내부조직 및 조직원간 경쟁, 보수대비 업무강도가 강함, 기획 직군의 경우 배운것을 써먹는 것이지 성장의 기회가 적음"
4,4,4,4,4,4,다양한복지와 업무환경지원 체계적인 업무분배등이 장점이다,비합리적인 성과제 뭔가 사람을 이용하고 버린다는 느낌 너무 과중한 업부분담
4,4,4,5,4,4,"복지, 정말 좋습니다. 책임출퇴근제라 4,5시 되도 탁구치고 플스하고 게임하러가구, 포스트 구글이라 불릴만함, 절대 다른 사람이 자신에 일에 관여안함",너무 자율적이라 신입사원이 알아서 일을 해야하는 단점이 있음
4,3,5,3,4,2,업무에서 많은 것을 배울 수 있슴. 복리후생 좋음. 열린 커뮤니케이션.,위로 올라가면서 점점 정치력이 좋아야 함. 회사가 분당이어서 서울생활권이면 다소 불편.
4,4,5,4,4,4,"경쟁력 있는 연봉과 복리후생, 동기부여가 잘 되어 있는 동료들","그다지 단점 까지는 아니지만, 모바일 서비스로 주축이 이동하면서 그 외의 서비스에 대한 관심이 줄어들고 있다."
4,4,4,3,4,4,"포털 1위라는 자부심과 직원에게주는 각종 혜택, 원하는 만큼 다양한 업무 맛볼 기회","갈수록 일에 너무 매몰되는 분위기, 일끝내도 눈치보며 야근"
3,2,3,3,4,1,"사내 어린이집, 2년에 1번은 10일의 연차를 써도 연차비를 줌(리프레쉬 휴가), 욕하거나 갈구지 않는 기업문화",혁신이나 창의적인 일은 없음. 단순업무가 많음. 월급은 대기업에 비해 적음. 점점 쇠퇴하고 있어서 미래가 없음.
4,3,5,2,3,2,자율출근제라서 짱좋음. 식당밥 맛잇고 싸서 식비절감가능. 휴양지 등의 복지시설 퀄리티 짱 좋음. 근무환경 매우 좋음. 타 디자인 회사에 비해 연봉 테이블 좋음.,탑다운으로 모든 일이 진행됨. 모두가 답을 알지만 땅따먹기 싸움 혹은 인센을 따내기 위한 어필을 하느라 답을 실행하지 못해 기동력이 떨어짐. 퇴근시간 10시는 기본. 평일엔 개인생활 즐기기 어렵고 개인 역량을 보여주려면 일단 줄 잘타야함.
3,3,3,1,1,1,1위 업체이니 그래도 적지 않은 것을 누릴수 있음. 외부의 평판도 괜찮음,합리적이지 않은 상하관계. 서비스의 부진. 사원들을 인정해주지 않는 분위기
1,1,2,2,2,3,경험의 확대 측면에서 다소 득이 있으나 조직이 비대해지다보니 맡는 업무영역이 제한됨.,서울대 인맥이 잠식한 회사임. 팀장 이하의 하부조직은 비서울대 인력이 많고 전문대 출신도 기용하지만 이상은 경우를 찾아보기 힘듬. 각종 인맥과 라인의 이전투구가 심함.
3,2,4,4,3,2,다양한 시도를 할수있고 자율성이 보장되는문화. 회사 환경이 좋아 쾌적하게 일할 수있음.,제각기인 팀문화로 협업이 힘듦. 자율적인 만큼 책임도 크지않은 분위기
5,4,4,2,4,4,"업무에 전념할 수 있는 환경제공에 돈을 아끼지 않음. 쾌적한 건물, 뛰어난 지하식당 등",내부 경쟁 치열. 벤처의 장점이 사라져 아쉬움
4,3,3,4,5,4,"내부 분위기 좋으며, 사옥이 번쩍번쩍해서 편하게 일할 수 있습니다. 구성원 개개인을 최대한 존중해주며 각 분야 최고의 인재들을 볼 수 있습니다.",벤처로 출발했는데 지금은 벤처가 아니고 한국형 대기업... 구글같은 자유로움을 기대한다면 업무 곳곳에서 한국 대기업의 향기를 맡을 수 있음
4,2,4,2,2,3,"훌륭한 동료들과 함께 일할 수 있고 자율출퇴근제,리프레쉬 휴가,쾌적한 근무환경,여성복지 등 다양한 복지가 잘 되어있다",겉으로 보여지는 자유로운 기업이미지와 달리 보수적이고 꽉막힌 문화
3,3,3,4,3,2,"10시 출근으로, 오전시간을 개인 시간으로 활용하기에 좋음. 상대적으로 자유로운 의사소통 및 업무체계를 가지고 있어, 신입사원이나 새로운 경력을 쌓으려는 직원들에게 좋은 환경을 제공한다. 또한 해당 업계에서 대우도 평균 이상을 제공하고 있다.","오랜시간동안 업계 1위를 유지해 오고 있어, 인력/업무적으로 사내에 큰 변화가 없는것이 단점일 수 있다. 특히 핵심 서비스 기획/개발 업무는 거의 해오던 인력들이 장기간 하고 있기 있어 진입장벽이 높고, 인력 구성의 변화는 기대하기 힘들다. 신입초봉의 경우 상대적으로 높은 편이나, 이후 급여 상승의 폭은 매우 낮은 편이다."
4,4,4,2,4,3,"직원복지가 많이 줄었지만 여전히 다른 회사들에 비해 높은 편. 회사의 문화가 젊은 편, 실력자들이 많아 신입으로 입사할 경우 배울 것이 많음, 직원들을 위한 소소한 선물 많음. 성과 승진으로 업무 능력이 좋을 경우 진급이 빠르고 연봉도 잘 오름, 근무 환경(건물 및 인테리어)","잦은 야근, 타이트해진 분위기, 잦은 조직이동, 복지혜택 축소, 성장부진"
3,4,4,5,3,1,UI가 우수하며 잘된 서비스 모방에 우수,너무 안일하게 일함. 직원들이 노는거에만 관심
4,3,4,4,2,3,"네임밸류, 전산개발인으로서의 목표, 무난한 복지","정치, 기술력, 공장, 생각보다 직급적 사고방식, 수직적인 느낌"
3,3,5,3,4,3,"자율출근으로 부담없는 업무환경
복지는 이것보다 좋은곳은 아직 못경험함",외부 이미지랑은 다소 차이가 있는게 아쉬움
3,3,5,4,2,2,자율 출퇴근제. 좋은 사옥. 맛있는 밥. 능력있는 동료.,"-개발자가 아니라면 좋은 대우를 받는 느낌은 아님..(특히 기획직군의 박탈감 심함) 다른 직군이라면 다시 생각해 보면 좋을 듯.
-조직이동이 지나치게 잦음"
3,3,3,3,2,3,복리후생 수준 높음 항상 위기의식을 느끼며 안주하려하지 않고 끈임없이 변화 시도. 실력있는 사람들이 많고 배울 점이 많음 회사 네임밸류가 높음,연봉은 겉에서 보이는 네이버에 대한 환상보다 높지 않은편 조직개편이 잦아 네이버로 입사했으나 갑자기 계열사로 전출될 가능성이 많은 회사. 사내 정치가 심하고 정치를 위한 일을 함 개인주의와 이기주의가 강한 기업문화
4,4,5,3,4,1,책임근무제로 자유로운 근무여건. 서비스와 밀접하게 엮여 돌아가다보니 적극적으로 IT개발의 실전역량을 키울수 있다.,"인사는 탁상공론 그 자체.
직원을 베타테스터로 사용함.
운이좋다면 진정한 능력자도 만날수 있지만 대기업에서 볼 수 있는 전형적인 정치꾼도 만날수 있는 곳.
엑스맨을 걸러낼 수 없는 시스템이 없고 엑스맨일수록 안 나가고 길게 다님."
5,4,4,3,5,3,개발자로서 트래픽이 많은 서비스를 운영해 볼 수 있다는 점이 좋았다. 동료 개발자들이 신뢰할 수 있다,배포가 잦기 때문에 신경이 쓰이고 그에 따라 야근이 발생함. 한달에 4번은 거의 필수 플러스 알파
3,4,4,2,3,2,"동종업계 복지최고수준, 평균이상의 연봉가능","인사제도가 정착되어있는것이 없다 실험하는느낌,회사내 정치,잦은조직개편"
1,2,4,2,4,2,"뛰어난 동료들이 많고 일처리가 빠름
국내 최고라는 자부심","타이트한 프로젝트 일정과 관리
개발직군의 개개인 내부 경쟁이 심한편"
4,3,3,3,4,3,"다양한 복지, peer review를 통한 의견 수렴, 다양한 사업 기회, 10시 출근","부장급 이상 승진이 어려움, 포지션에 따라 layover 심함"
3,3,4,3,3,2,자유롭고 젊습니다. 전국민서비스를 해볼수있는기회,경영인의 간섭이 심하고. 은근 정치가 심함
5,4,5,3,4,3,"높은 급여, 자유로운 분위기, 수평적인 조직구조",조직마다 분위기가 많이 다른 것 같다.
4,3,4,3,3,3,"부서에 따라 조금씩 다르지만 자유로운 분위기, 전반적으로 타 회사에 비해 직원들에 대한 복지가 좋음. 업무에 대한 이해도가 높은 인재들이 많고 젊은 인력들이 많기 때문에 사람 대 사람에서 오는 스트레스 자체는 타 회사보다 적은 편.",국내 서비스에 대한 지속적인 피드백이 약간 느림. 업무에 대한 강도는 센 편. 경쟁이 굉장히 심한 편이기 때문에 지속적으로 공부하고 스스로 발전하려 하지 않는 사람은 쉽게 지치고 나가떨어질 수 있음.
4,3,4,4,3,3,"부서에 따라 실행 여부는 복불복이지만 회사가 권장하는 전반적인 복지(책임 근무제, 동료평가, 대출 및 교통비) 원칙만 놓고 보면 매우 잘 정비되어 있음.",국내를 넘어 글로벌 시장을 공략하는 과정에서 국내 서비스 관련 부서에 소홀함.
4,2,4,2,4,5,"다양한 사람들과 일할 수 있어서, 좋은 친구이자 동료들이 생겨나는 곳. 사회 초년생들에게 정말 추천.",느러지는 업무 시간. 부서간 이기주의. 대기업에서 나타나는 평범한 단점들.
4,3,4,4,3,3,자율출퇴근. 소프트웨어 중시. 그럭저럭 만족할만한 연봉.,자주 바뀌며 이해할 수 없는 인사제도.
4,3,5,2,4,3,"자부심이 느껴진다.
국민의 서비스를 한다는점과 지인들에게 자랑할만한 거리가 많다. 일을 할수록 소속감이 강하게느껴지는회사","업무가 정말 힘들다
스스로 게으르다면 비추천. 때론 너무 타이트하고 의사결정이 너무 느린것이 단점이기도 하다."
5,5,3,4,5,4,"비교적 자유로운 분위기에서 근무 가능.
만족할만한 복지.","너무 잦은 조직 개편.
상하관계 소통이 어려움."
4,4,4,4,5,3,적당히 괜찬은 복지와 자율 출퇴근제 등으로 자신의 삶의 질을 유지하면서 다닐 수 있음,투명하지 않고 자주 변경되는 인사 정책(2015년 연봉 상승율을 아무도 모름)으로 인해 최근 직원들 사기가 많이 내려감
4,4,4,3,4,3,함께 근무하는 사람들이 기본적으로 일을 잘하는 사람들이 대다수. 업무 체계가 잘 잡혀있다.,"야근이 잦고, 새로운 것을 만들어내야한다는 압박감이 늘 있음."
3,2,3,3,3,3,"자율 출퇴근제, 회사 내 PT, 휴양시설을 이용할 수 있음",조직에 따라 평가 방식과 연봉 책정 방식이 다른 점
3,1,3,3,3,1,"기업문화가 자유롭고, 책임출퇴근제로 시간을 내 의지대로 사용할 수 있다.","능력을 중시하는데, 그 능력의 기준이 모호하다. 생각보다 연봉이 낮다.
주니어들은 좋지만, 시니어들은 연봉 인상도 거의 없고 오래다닐 수 있는 회사가 아니다."
3,3,4,4,4,2,국내에서는 최고.. 갑질까지는 아니어도 꿀리지 않게 일을 진행할 수 있음,"서비스의 진정성이나 가치보다는, 윗사람들의 정치싸움과 싸바싸바로 일이 제대로 되지 않음"
