star,promotion,welfare,worklife,culture,ceo,merit,disadvantage
4,3,4,3,4,4,국내 동종업계 1위인 만큼 배울 것이 많음. 복지도 좋은 편인 듯. 사내에 편의시설 대부분이 갖춰져있고 회사 위치도 좋음.,인턴으로 근무했기 때문인지 큰 단점은 없는 듯. 주말출근이나 야근이 종종 있음.
5,4,5,2,5,3,"전국민이 사용하는 인터넷 서비스를 개발할 수 있음
훌륭한 실력의 직원이 많음
복지 및 급여도 매우 좋은 편","일이 많은 편이다.
전국민을 상대로, 많은 사용자를 대상으로 24시간 서비스가 많다보니 스트레스를 많이 받을 수 있다.
몇 개월간 밤새 개발한 프로젝트가 드랍되는 경우가 가끔 있다."
2,1,3,3,3,2,복지가 좋고 건물 좋음 출퇴근 자율적임,출퇴근이 없으므로 주말이던 밤이던 정당하게 사내메신저 통해 업무해야함. 정치인들이많고 최근들어 점점 분위기 안좋아짐
4,4,4,3,3,2,국내 포털 1위 자부심. 복지는 국내 최고수준임.,"의사결정이 늦어지는 경우가 많음. 사내 정치와 야근에
대한 부담감이 있음"
2,2,3,1,2,1,"IT기업 중 정말 몇 안되는 형식적인 야근수당 주는 회사 (슬프다...)
한 20% 정도는 정말 실력이 좋은 사람들 같다.",종잡을수 없는 방향성...왔다리 갔다리...갈수록 더 쪼아대는 분위기...
5,1,5,5,4,4,"자율출퇴근, 상해보험 등 복지, 무료아침식사","Top-down 방식의 개혁 방법이 잘 먹히지 않아 정체 상태
회사 정책이 자주 뒤집힘"
3,4,4,2,3,3,"확실히 대기업으로서의 자부심이 있다 처음으로 나의 디자인이 대부분의 사람들이 사용하는 포털 사이트의 메인에 걸렸을 때의 뿌듯했던 기억
개발 환경이랑 복지 좋음",야근이 너무 잦음 야근도 잦고 주말 근무도 종종 있었고 그러니까 일의 양이 너무 많음 경쟁도 잦음
4,3,4,2,4,4,투명함과 인지도로 대부분의 임직원들이 네이버에서 일한다는 자부심을 갖고 있다,일이 많고 변화가 빨라 일과 삶의 조화를 중요시 여기는 사람은 인정 받기 어려운 구조
4,3,4,4,4,4,"여사우를 위한 복지가 좋다 (출산, 육아 휴직 관련)","너무 잦은 조직개편, 평균근속연수가 짧음"
3,4,4,2,4,3,"도전적인 업무 분위기, 복지와 근무환경은 업계 내 높은 수준","조직별로 업무 환경과 만족도, 스트레스 편차가 큰 편.
계속 경쟁사와 비교하며 타이트한 일정에 새로운 기획을 요구하므로 본인 스스로 그 속도에 맞추지 못한다면 일에 끌려다니게 됨."
4,4,4,3,4,3,"국내 IT업계 1위 수준에 걸맞는 대우, 복지, 자율성.","너무나 잦은 조직 개편, 매번 바뀌는 평가 시스템 등 아직도 안정되지 않은 모습이 많다."
5,4,5,3,4,4,"업계에서 확고한 인지도를 지니고 있으며, 어느 직종에서 근무하던 큰 규모의 사용자를 대상으로 하는 얻기 힘든 경험을 습득할 수 있음. 직원들의 수준도 대부분 높기 때문에 경험/인맥 측면에서도 플러스. 근무 조건이나 복지 등의 처우, 연봉/인센티브 등도 만족스러운 수준.",10년이 지나가니 내부적으로 삐그덕 한다는 소리가 점차 들리고 있음. 위에 적은 장점들이 요즘은 점차 퇴색되어가고 있다고 함. 모바일 시대에 다음-카카오에 비해 선도적인 모습을 보여주지는 못하고 있음.
3,3,4,3,4,3,"비교적 자유로운 근무분위기와 확실한 복지, 대외적인 이미지가 좋아서 커리어에는 꽤 도움이 됨",너무 잦은 조직변화로 인해 불안정한 면이 있고 나이들어서도 꾸준히 일하기는 어려울듯 함
4,3,4,3,4,4,"자유로운 문화와 복지!!! 훌륭한 동료들과 함께 일 할 수 있고, 네이버를 다닌다는 자부심!",업무가 다소 많다고 여길 수 있습니다.
2,3,4,3,4,3,다양한복리후생과 업무스킬 상승 훌륭한인재덕을많이볼수는있음 그리고급여도훌륭하게만족,업무강도가쎈편이라 퇴사우려가생각해볼수있음 몇몇사람들이텃새가있어 그걸견뎌이겨야함 그러지못하면낙오자가됨
3,3,4,2,3,3,"동종업계중에서는 최고의 대우, 다양한 직종의 사람들과 커뮤니케이션하고 일할 수 있다는 장점.",항상 IT 트렌드에 뒤쳐지지 않게 노력. 긴장은 필수. 함께보단 스스로 성장하지 않으면 안된다는 점에서 스트레스가 많음.
3,1,3,4,2,2,다양한 서비스를 경험할 기회가 많아요. 대규모 서비스 경험,인맥 위주의 인사 시스템이 직원들의 사기를 떨어뜨린다. 낙하산
4,3,5,4,4,4,복지와 급여가 남부럽지 않고 업계 최고 경력자들과 일하며 쌓을 수 있는 것이 많다.,"기술, 개발직이라면 많이 성장할 수 있지만 정말 힘들긴하다."
4,4,5,3,5,3,"수평적인 문화
아침식사 제공, 저렴하게 질 좋은 식사를 할 수 있는 구내식당, 좋은 근무환경, 복지",부서에 따라 다르지만 서비스기획의 경우 Work&Life balance를 이루기 힘든듯하다.
3,3,5,2,3,3,복지는짱이에요 사람들사이에도돈독하고좋아요 시설도엄청잘되어있구요,야근이잦아요 하지만 서로으쌰으쌰합니다 생활을포기해야되지만 기혼자는비추인것같아요
4,4,3,3,3,4,뛰어난 동료들과 일하며 많은 걸 배울 수 있다는 점.,지나치게 경쟁적인 분위기는 팀웍을 저해함.
3,3,3,5,2,1,"복지 매우 훌륭한편 삶의 여유를 느낄수 있음
본인이 노력한다면 괜찮은 성장을 기대할 수 있음",불투명함 불통 뭐 하나 하기 되게 힘듬 회사의 부속으로 느껴지기 쉬움 나이브 하게 노는거나 빡세게 하는거나 회사로부터의 보상은 별 차이가 없을것이
4,3,4,3,4,3,기업 문화가 젊고 자유로운 분위기이다. 그리고 여러가지 지원을 받을 수 있다.,인사 제도가 이해가 안 되는 경우가 가끔 있음. 알바가 정규직이 된다거나..
4,3,5,4,4,5,"자율적인 출퇴근 시스템과 훌륭한 복지시스템
무엇보다 '지속적'으로 성장을 하고 있다는 점이 좋다고 봅니다 (물론 최근에는 국내시장에서 정체이긴 하지만요)","사내 정치에 신경쓰다보면 업무 집중도를 방해할 수도 있다고 봅니다.
어느 회사나 마찬가지지만, 성과가 나는 부서와 나지 않은 부서가 나뉘어있어
개인이 느끼는 성장의 정도가 다를 수 있는 가능성이 높음."
3,3,4,2,4,4,대기업화되어 사내 정치가 많다지만 현재 있는 대기업에 비하면 일 잘하고 정직한 인재가 많다고 생각됨..국내에 이만한 회사 찾기 힘듦. 물론 복지도 훌륭..,경쟁이 심해 업무 스트레스가 높고 프로젝트 진행 시 완성도 있는 결과물을 내려면 야근은 필수임..
5,4,4,3,5,3,국내 최고의 인터넷 기업이죠. 책임근무제를 도입하면서 출퇴근 시간이 의미없어졌죠. 기타 복리후생 좋습니다. 직원들이 일을 잘 합니다,직원들의 능력을 잘 활용하지 못하는 느낌이에요. 자발적으로 하고싶은 것을 더 많이 할수 있으면 좋을듯
4,3,3,4,4,4,"비교적 수평적인 기업문화, 업계 특성상 젊은층의 흥미를 당길만한 복리후생",회사와 지금 내 상황에는 매우 만족하지만 업계 특성상 이것이 몇십년간 지속될까라는 불안감은 내재되어 있는 편
4,3,4,3,3,3,신입일 경우 본인이 이 악물고 적극적으로 배우고자 한다면 무한성장가능,신입일 경우 본인이 수줍음 많고 내성적이면 성장하기 어려움
3,4,3,1,4,2,공부하는 사내 분위기. 하고자 하면 기회가 많이 주어짐. 책임 근무제,변화와 혁신을 하지 않으려는 보수적인 업무태도. 생각보다 일 못하는 사람이 너무 많음
4,3,5,5,4,4,"잘 모르는 바깥 사람들은 대기업이니, 공룡이니 부르길 좋아하지만, 스스로 변화하고 진화하려는 자가 학습과 자가 발전기능이 강력한 기업. 복리후생 수준, 팬시한 업무 공간 이런건 두말할 필요도 없고.","임직원 모두 수줍음이 많음.
임직원 개개인의 노하우, 지식, 경험 등이 사내에 축적되기 어려운 문화."
4,3,4,5,4,3,"컴퓨터 소프트웨어 개발자가 중요한 직군인 회사이기에 개발자는 입사할만함.
지금도 그런지는 모르겠지만, 내가 다닐땐 유능한 사람들 많아서 배울거 많았음.","네이버의 매출은 조금씩 계속 증가하고 있지만, 증가율이 떨어지면서 그에 따라 고 평가된 주가도 떨어지니 그 상황을 경영진 자신들의 잘못이 아닌 직원의 무능과 나태함으로 인해 발생했다고 평가해 버리는 회사.
다행히 라인이 잘되서 다시 주가는 상승했지만, 라인 후속이 없으면 또 다시 직원을 탓할 회사.
직원들 칼퇴근한다고, 퇴근 버스 없애 버리는 회사."
4,3,3,1,3,1,다양한 복지의 혜택. 비교적 자유로운 분위기,조직장에 따라 분위기가 달라짐 조직장 정말 중요
3,4,4,2,3,3,"업계 최상위권 연봉과 복지.
뛰어난 동료. 인프라.
대용량 처리 경험.
이것저것 해볼 수 있는, 다양한 서비스들","정부로부터의 지나친 규제로, 국내 신사업이 정체됨.
라인에 너무 의존하고 있어서, 본사 근무자들이 힘들어 함.
최근 잇단 분사등으로 인한 불안감. 언제 분사로 나가게 될지 모름.
Work-Life 중에 Work 쪽으로 치우침."
3,4,5,5,5,4,복지가 좋습니다. 똑똑한 직원들이 함께 하여 업무 진행이 합리적입니다.,"다소의 사내정치로 인해, 성장의 속도가 늦어지는 경향이 있습니다, 업무진행속도가 벤처에 비해 늦습니다"
4,4,5,3,4,3,직원들을 위한 다양한 복지와 동종업계 내 최고 수준의 연봉.,부서마다 복불복. 어느 회사나 똑같겠지만.
2,1,3,3,1,2,안정적인 근무환경으로 상대적으로 다른 it회사에 비해 오래 일할수는 있습니다(40대 다수 있음),이기적인 사람들 분위기. 협업하는 즐거움이 없음
4,3,4,3,3,4,"한국 1위 포털 서비스를 만들고 유지하는 능력과 체력을 겸비한 회사
글로벌 시장에서도 도전하여 당당히 성공 사례를 만들고 있음
부수적인 것들을 과감히 버리며 회사의 핵심 역량에 집중하는 경영진(창업주)의 열정과 결단력","아직도 인사평가제도가 정착되지 못하고 매년 시행착오를 하며 피해자를 낳고 있음
수시로 조직 개편을 하며 회사의 경쟁력을 다지기 때문에 개인의 커리어 계획이 꼬일 수 있음"
4,3,5,4,5,4,"자유로운 사내 분위기, 퇴근 시간, 직원 복지 등",자유로운 분위기지만 성과물을 내지 못하면 자연스레 도태되는 것은 이곳 역시 마찬가지
3,3,3,4,4,3,다양한 복지. 자유로운 분위기. 배우고자 하는 만큼 배울 수 있는 곳임. 조직마다 다르지만 분위기 나름 자유로움.,보수적인 상사가 있는 조직이면 분위기 안좋음. 평가도 공정치 못하고 상사가 좋아하는 팀원에게 몰아줌. 특히 외주 아웃소싱하다 운좋게 들어온 인력들은 다 잘라버려야됨.(특히 조직장들) 분위기파악 못하고 네이버를 저질회사로 만드는 주역임.
3,3,4,4,4,2,다양한 프로젝트가 진행되는 회사인 만큼 자부심도 강해지고 대한민국 1위 다운 새로운 일들을 많이 경험할 수 있음,정치가 심한 편이고 신입이 할 수 있는 일은 많지 않음
4,4,5,4,4,3,"정말 좋은 복지, 색다른 사내문화, 적지않은 연봉",변화가 잦다. 또한 자사 프로그램 등을 강제적으로 써야한다.
5,4,4,3,4,3,"자율출퇴근제(본부마다 상이), 복리후생, 눈치볼필요없는 갑의회사","상호평가의 무의미하고 불필요함, 점점 대기업화되가는 분위기, 탑다운의 업무가 많음"
2,3,3,2,1,1,국내 1위이고 많은 훌륭한 인재를 접하며 배울 수 있다.,직원들이 네이버의 서비스의 특성 때문인지 일을 하다가 조금씩 이상한(?) 사람이 되어가는 경우가 많다. 임원도 마찬가지임.
4,3,4,2,3,3,젊은 회사. 복이후생 좋은 편이고 직원들이 꽤 괜찮은 편이여서 인맥과 경력에 도움이 많이 됨,내부적으로 대기업화 되가고 있다는 느낌.
4,3,4,3,4,4,"자유로운 근무여건, 사원복지, 본부장이 쏘쿨함",너무 단기간에 성과가 나오기를 기대하는 편.
5,3,3,4,3,3,"일단 기본적으로 한만큼은 가져간다. 단지 그이상을 원하면 처세술을 부려야 한다. 처세술에는 여러가지가 있겠지만. 기본적으로 경쟁자들을 밟아라, 우아하게",학벌과 인맥에 목숨건다. 왜냐하면 종착역이니까 더이상 갈때가 없다. 고참이 제대 안하고 10년동안 있으면 넌 10년동안 이등병이다.
3,3,3,2,4,2,계속 발전하거나 현재의 위치에서 머무를수 있는 회사. 누가 뭐래도 대한민국 인터넷포털1위기업.,직무에 따라 다르지만 전반적으로 업무강도가 쌔고 외부에서 보는것과 달리 탑다운방식의 문화가 많음.
4,3,3,3,4,2,"자유로운 분위기, 일만 잘하면 터치하지 않음. 복장자율에 부서내 분위기도 좋은편",회사 근처에 아무것도 없다. 10to7이지만 칼퇴하는 사람은 거의 못본듯
4,4,5,1,4,4,수많은 사내 전문가들과 일하면서 다양한 경험을 할 수 있다.,일 외의 개인적인 삶을 충분하게 누리기 힘들다.
4,2,4,2,4,2,이용자 퍼스트가 지켜지는 회사. 좋은 복리후생,그러나 임원층이 오너를 따라갈 능력 부족.
5,3,5,4,3,3,"국내 1위, fancy한 기업 느낌, 잘만 한다면 직장&생활 밸런스 맞추기 매우 좋음","벤처임에도 몸집이 커져서 점점 대기업화되고 있으며, 이에 따라 종종 부적절한 인사 조치가 있을 수 있음. + 정체되어 가는 느낌이 들고 있음."
4,4,5,3,4,3,"업계 1위 기업이라서 할 수 있는 경험이 많음.
타사대비 절대다수의 액티블 유저를 대상으로 큰 서비스를 경험할 수 있음",head쪽에서 무능한 인력이 있는 편인데 상당히 피곤함.
4,3,4,3,4,4,"훌륭한 동료, 좋은 기업 문화, 글로벌 회사 경험, 직원의 성장 지원",국내에서 제일 잘하는 사람들만 모아놓아 그 안에서 경쟁해 기회를 얻는게 쉽지 않다.
3,2,3,2,3,3,"장점이 딱히 없다, 그냥 계약직으로 잠깐잠깐 떠돌이 사람들을 뽑는걸로 생각하고 있는거 같다.","단점은 연봉이 적다.그냥 계약직으로 잠깐잠깐 떠돌이 사람들을 뽑는걸로 생각하고 있는거 같다. 그래서
연봉이 적다"
4,3,4,3,4,3,많은 뛰어난 동료들이나 선배가 존재한다. 뭔가 궁금한게 있을 때 회사내에 적어도 전문가가 존재한다.,"일이 많음, 일정이 박혀서 내려오는 경우가 많아서, 야근을 해야하는 일이 많음"
3,3,2,3,4,4,뛰어난 능력을 가진 사람의 비율이 타사에 비해 높다. 전국민을 대상으로 한 서비스를 만드는 자부심을 느낄 수 있다. 타사보다 나은 품질 프로세스를 보유하고 있다.,최근 남아있는 사람들 중 심각하게 무능한 사람들의 비중이 높아짐. 제조업 분야에서는 네이버 출신 인력을 그다지 선호하지 않는다고 알려짐.
4,3,4,3,4,3,"편안한 복장, 일에 있어서 개인적인 책임과 역할, 사내부서이동제도 등.","어느회사나 다 그렇지만, 업무간 협조가 조금 떨어집니다."
1,1,2,1,1,1,"국내1위, 글로벌성장 가능성, 젊은사람이 많고 복장규정같은것이 없는 만큼 자유롭다. 복지가 잘 되어있고 쾌적한 근무환경","야근을 안하면 일을 안한다는 분위기, 상명하복의 대기업문화가 자리잡고있습니다. 중장기적 보다는 단기적 실적향상에만 치우쳐 있고 개개인의 의견을 반영시키기 힘듧니다."
3,1,4,3,2,3,"최근 많이 축소되긴 했으나 그래도 좋은 복지와 사무환경, 안정적인 급여, 대기업 이미지.
업계에서 실력있는 사람들이 많이 모여있어 좋은 자극이 될 수 있다.","정체된 인력구조로 승진의 기회가 많지 않음.
사람이 많아짐으로써 프로젝트 성과에 대한 눈치 보기, 밥그릇 싸움 등의 문제."
4,3,4,3,4,4,급여 복지 경력 자부심 경영자 철학 협업자들의 능력,대기업화 / 실장이상 직책과의 소통 부족 또는 방어적이거나 우유 부단한 의사결정 (본부 실 팀에 따라 다를수 있음)
4,4,4,4,4,4,회사에 부대시설이 좋다. 내 주변동료의 능력이 뛰어나기 때문에 배울점이 많다.,"연봉이 높고, 복지가 높은 만큼 원하는 일의 양이 많다."
4,3,4,3,4,2,"노력한다면 배울 수 있는 것이 많고, 업계 1위이기 때문에 성과에 대한 압박은 적다. 성과에 따른 보상은 크다.","신입으로 들어오기 경력보다 몇배는 힘들지만, 들어간 다음 체계적인 케어, 교육프로그램은 아직 체계적이지 않은듯하다. 다들 바쁘기 때문에 사수를 잘못 만나면 막내 시절 일을 제대로 못 배우고 방치될 수도 있음."
3,3,3,1,4,3,"기업인지도로 인한 자부심
뛰어난 복지
1시간 늦게 출근 1시간 늦게 퇴근","생각보다 개발자로써의 메리트를 느끼기 힘듬.
업무강도 강한편.."
4,3,3,3,3,3,"국내 제1의 it업체. 본사 시설 매우 뛰어남.
많은 업무 경험 가능.","야근이 잦음.
생각보다 낮은 연봉."
3,2,3,3,2,3,"기존 로컬 비즈니스가 여전히 탄탄하며, 라인 등의 신규서비스 등장으로 앞으로 지나온 만큼 충분히 잘 해내리라 생각되는 곳.","라인을 타고 글로벌 경쟁으로 뛰어든 만큼, 따뜻한 로컬 비즈니스의 시대는 끝난 듯. 그간 따뜻했던 분위기때문인지 열심히 일하는 분위기보다는 안전편승하려는 무리들이 많은 것은 단점."
3,3,3,2,4,3,점점 대기업화되가고잇어 아쉽지만 그래도 제조사보단 열린곳. It 웹회사중 아마도 가장 좋은 보수,암묵적 야근 강요와 젊은 기업으로보여도 생각보다 아쉬운게많음
3,3,4,2,3,3,업계 1위의 자부심. 복지. 명성. 기회,너무 심한 정책과 방향의 변화와 업종 자체가 주는 불안정성
4,3,2,4,5,2,국내 포탈 1위 답게 실력자들이 모여 있다. 커리어를 쌓기에 좋은 환경. 사내 분위기도 최고.,"검색, 기술쪽 보다는 블로그, 카페 등 서비스 쪽에 너무 치중하는 느낌이 들어서 연구직 엔지니어들은 약간 대우가..."
3,2,4,3,4,1,직원들이 회사를 사랑하고 불평이 별로 없는 회사 동료들간 관계가 좋고 좋은 인재들이 모여있어 업무 진행이 빠르고 창의적임 별 것 아닌 것도 브랜딩을 잘함,하지만 갈수록 모든 제도와 평가 관리 규제 등이 삼성전자화되어가고 업무 강도는 높아져 안타까움 주요 인재들은 라인 등으로 이동 중 승진기회는 갈수록 제한적이며 임원들과 관계가 좋아야지만 승진 가능 기준이 불명확함
2,2,1,2,3,1,"입사 후 몇개월 혹은 몇주..간 느낄 수 있는 복지.(조식, 카페, 휘트니스 등)
자랑스럽고 괜찮아보이는 사옥. 10시 출근. 교통비 명목 야근 수당으로 용돈벌이할 수 있음. 사내 카페서 휴식 가능(부서에 따라 다름).","대기업으로 분류 but 체계가 전혀 안잡혀있음. 밀어주는 부서 가끔있지만 부서 간 갑을관계 존재함. 계열사간 갑질.
개발>>>>>>>>>>>>디자인>>기획. 업무 강도 대비 터무니없는 연봉. 다니다보면 왜 분당에 회사를 지어놨나 잘 알 수 있음. 야근시간을 평가에 반영하는 임원. 사내 복지라고 마련해놓고 업무 시간에는 이용제한."
2,2,4,1,4,2,"다양한 사내 복지 및 세련된 설비와 디자인의 사옥. IT 기업중 국내 최고라는 자부심을 가질 수 있다. 훌륭한 인재들이 가득해서 서로 생산적인 자극을 받을수 있다.
업계 최고 연봉을 받을 수 있다.",사내에 너무 많은 소문이 돌아다닌다. 오늘 A씨의 사건이 물망에 오르면 일주일내에 전직원이 A씨의 사건을 안다. 직원들간 치열한 경쟁을 부추기는 사내 문화가 있어 정신적으로 피곤하다.
4,2,4,4,3,3,"복지는 업계 최고임은 인정, 업무 강도도 적당하다.
그러나 부서별 업무 강도와 야근은 강도가 틀리다.","사내 정치와 편가르기 문화가 있어, 정제가 될 필요가 있다."
3,3,3,2,4,2,"근무환경이 좋음, 출근시간 좋음, 다양한 개성을 존중하는 분위기.",출근이 늦는만큼 퇴근시간도 늦음. 일과 생활의 균형 유지 어려움.
4,3,4,4,4,3,최고들과 일하면서 역량을 쌓아갈 수 있는 것,"벤처에서 시작해서 이제 대기업 문화가 많이 자리잡음. 어느정도 올라가면 학벌, 연줄 무시못함."
3,3,3,3,3,3,괜찮은 연봉 수준. 국내 최다 이용자를 보유하고 있고 실력있는 선임들이 많아 일을 잘 배울 수 있다.,어느 순간 부터 대기업과 같은 분위기가 되어가고 있다.
3,3,4,3,4,3,인터넷 분야의 국내 최고 전문가와 함께 일할 수 있음.,그동안 바로 써먹을 수 있는 경력직만 뽑다보니 사원대리가 귀함;
4,3,4,4,4,4,"넉넉한 출근시간과 맛있는 지하 식당, 4층 카페 등등 복지 짱~ 사무 공간도 쾌적해서 좋았음. 일하는 팀원분들도 좋았음.","본부장님을 위해 일하는건지 유저를 위해 일하는건지 혼란이 왔고, 기획과 디자인과 개발이 매끄러운 커뮤니케이션이 잘 안되었음."
4,3,5,5,2,4,한 번 들어오면 나가기 힘들 정도로 좋은 근무환경과 급여수준,개인주의적 성향이 강하고 직급이 올라갈수록 버티기 힘듦
3,3,2,2,4,3,아직까지 많은 사람이 알고 있듯이 1시간 늦은 출근과 늦은 퇴근이라거나 사내 복지시설 이용 및 자유복 출퇴근과 같은 다소 비수직적 조직문화가 좋으며 여성 인력이 많다 보니 여성 복지에도 신경을 많이 쓰고 있음.,출발이 벤처였기 때문에 조직문화가 좋다고 알고 있지만 점차 대기업화 하면서 여타 대기업과 다를 바 없는 조직문화로 이행하려는 움직임이 엿보이며 기업 규모에 비해 연봉이 적음.
3,3,4,3,3,2,"IT 최고업계에서 일할 수 있는 기회는 좋은 경험이고, 사내 복지 및 기업문화 부분에서 장점을 가지고 있음.",조직 규모가 커지는 것과 달리 경영진에서는 벤처 정신을 강조하며 인사정책에 일관성이 없음.
4,3,3,3,3,4,큰 서비스를 운영해 볼 수 있고 서비스를 대충 만들어도 네이버니깐 무조건 1위를 할 수 있음. 자유로운 영혼의 기획/개발/디자이너라면 조직생활과 사내정치를 배울 수 있는 좋은 기회,연봉이 생각보다 낮고 IT벤처의 자유로움과 열정을 강조하지만 결국 야근 횟수를 세고 있는 알 수 없는 기업 문화
4,4,5,2,2,3,다양한 개발 분야에 대한 다양한 개발 경험을 쌓을 수 있음,일과 삶의 균형이 심각하게 맞지 않음
4,3,4,2,3,3,개발자가 그나마 다니기 좋은 회사. 복지가 많이 줄어들었지만 그래도 아직은 괜찮다.,의미없는 야근 강요와 능력보다는 라인 위주
4,4,5,5,3,2,"가족까지 보장되는 보험
성과별인센티브가 있어 능력을 발휘하면 얼마든지 높은 보상을 받음",일년에 두번씩 평가 기간에 협업한 분들로 부터 익명의 개선점을 받음
3,2,3,3,2,1,많은 사람들이 쓰는 서비스를 만들어보고 운영해볼 수 있는 기회,회사는 성장하고 있는데 복지는 점점 축소되고 연봉은 제자리 걸음. 불필요한 야근 강요
3,2,3,1,3,1,아직까지는 장점이었던 복리후생 제도가 남아있음. 복장 자유로운 점도 장점,"지나친 사내 정치와 인력 적체가 심해 어느 팀이나 부장, 차장이 주를 이룸. 비상식적 야근 강요"
3,4,3,4,3,3,"동종업계국내1위라는 자부심, 최근 글로벌하게 나아가는것도 장점. 일은 개인의 노력여부에 따라 많이 배울수 있어요.","감축되어가는 사내복지, 불공평한 인사 리뷰와 이에따른 사내정치"
3,3,4,2,2,2,IT 업계 국내 1위 회사로 이 방면에 관심이 있다면 좋은 커리어가 될 것입니다.,비합리적인 인사와 업무분장. 업무의 불안정성.
3,3,4,4,2,2,네임벨류. 높은 복지수준. 세련된 인테리어. 라인의 글로벌 성공으로 인한 높은 인센티브 기대,극심한 사내정치. 체계적이지 못한 인사평가. 메이킹한 이미지와 달리 보수적인 조직문화. 실력보다는 말잘듣는 사람이 높은 평가를 받고 실력있는 사람은 점점 회사를 떠남.
3,3,3,5,3,1,대국민 서비스를 만든다는 보람이 있다,"다들 삼성전자로 갈까 말까 고민한다.
삼성전자연봉의 70% 수준밖에 안된다"
