star,promotion,welfare,worklife,culture,ceo,merit,disadvantage
4,2,4,3,4,3,"부부 양가 부모님까지 제공되는 상해보험 등 직원 복지가 국내 탑 수준
대부분의 직원들이 젊고 합리적인 사람들이라 업무에 대한 결정도 대체적으로 합리적인 편 (정치가 존재하긴하나 타 회사에 비해 적은 편이라 판단됨)","규모가 지나치게 커져 업무 진행에 있어서 비효율적인 부분이 있음
또한 대기업이다보니 일반 직원들이 맡은 부분은 매우 작은 부분이기에 업무에 대한 성취감은 적을 수 있음"
4,5,4,3,4,3,"좋은 복지와 근무환경
함께 일하는 사람들에게서 본받을 점이 많음
빠르게 변화하는 산업인 만큼 배울 것이 많고 즐거움","업무에 대한 스트레스가 많음
인턴에게도 한 사람의 몫을 동등하게 요구함
빠르게 변화하는 만큼 다른 업계보다 산업 자체에 대한 불안감이 큼"
3,2,3,2,3,1,"개발자로서 국내 1등 및 글로벌 서비스 경험을 해볼 수 있음
다양한 상황을 겪고 배울수 있음
책임근무제 및 푸르니어린이집 운영으로 육아와 직장생활 병행하기가 그나마 가능함",책임예산제로 리더한테 잘못보이면 연봉도 인센도 꽝 인생 괴로워짐 사내전배나 이직만이 탈출 방법임 리더 평가 체계가 부족해서 생각보다 수준떨어지는 사람들이 위에서 안나감
5,3,5,5,5,4,"수평적인 조직 구조 = 기업의 문화 / 이를 지키기 위해 상당한 애를 씀
경력으로 과/부장급이 와도 적응 못하면 윗사람이여도 아웃",개개인의 능력 중시 / 자신의 가치 입증 못하면 도퇴 / 이로 인해 자기개발에 대해 1년 365일 노력해야 함 / 칼퇴해서 편해보이나요? 계속 다니고 올라가려 스터디 가는 겁니다(는 칼퇴가 뭐죠? 우리팀 왤케 바쁨)
4,4,4,4,5,4,"강압적인 분위기 없이 자기가 주도적으로 업무처리할 수 있는 환경. 책임도 커서 성과가 주요하지만 그럼에도 자유로운 분위기가 업무 효율을 높인다. 조직 문화가 무척 유연하고 친여성, 친가족적 분위기가 있어 그런 점이 좋다.",업무량 결코 적지 않다. 또 홍보팀은 특히 다른 직군 사람들과 접촉할 기회 많은데 IT 회사 특성상 다른 업무에 대해서도 전문적까진 아니어도 어느정도 지식을 알아야 한다. 그런 것들을 미리 알고오면 더 좋았을 듯.
5,4,5,3,5,5,친절한 사람들 깔끔한 구내식당 좋은 근무 환경 출퇴근버스 잘 되어있음,많은양의 업무가 주어지다보면 초과해서 근무해야할 때도 있습니다
5,4,4,5,5,2,"복지나 개발환경, 시설 등 다 좋음
부서마다 다르겠지만 야근이나 휴일근무는 손에 꼽힘","회사 이미지가 상생인걸로 아는데 전혀 그런 느낌이 없음
경영진들은 잘 되는 서비스를 배껴야 한다는 생각이 있는듯"
3,5,2,1,2,2,"자유로운 복장, 시설 좋은 사옥, 값싼 사내식당은 좋음. 네임밸류 있어서 어디나가서 말하면 대단하다고 생각함.","매일 오전 10~ 오후 10시 12시까지 이어지는 야근. 워라밸 지켜지는 대기업을 상상한다면 전혀 다르니 알고 입사할 것. 주말 출근을 당연시 여기며 눈치야근 or 업무야근 모두 해야함. 부서 바이 부서가 심하긴 하지만 전반적으로 빠른 업무 습득/성과 그리고 야근/주말 출근에 대한 압박이 매우 큼.

대기업의 연봉을 기대하면 안되며, 경영지원에 한해서는 업무량에 비해 매우 박봉임."
4,3,5,2,4,2,"연봉 좋고, 성장가능성 좋고 능력 있는 사람도 많아요.",예전과 비교해 기업이 좀 딱딱해졌어요. IT기업의 느낌이 좀 줄어드는...
4,4,4,3,4,4,"연차를 맘대로 사용가능, 좋은 복지, 좋은 위치, 자유로운 분위기의 사람들, 괜찮은 연봉","야근이 잦음, 업무 강도가 쎈편이며, 잘못 걸리면 몸이 힘듬, 발전이 되는듯 안되고 있는 단점"
4,5,4,1,3,4,글로벌 기업. 제조업이 아니므로 수익이 많이 남을 수밖에 없는 구조. 국내 검색광고 독점,회사 규모가 큼에도 여전히 스타트업 같음. 일의 양이 무궁무진하게 많아서 상상을 초월하는 야근의 연속.
4,4,4,4,4,4,책임근무제로 출퇴근 시간 및 휴가 사용이 자유롭습니다.,개발이다보니 언제 어디서 장애가 날지 모르고 유저가 워낙 많아 신경이 쓰입니다.
4,4,4,2,4,3,"연차 사용 대체로 자유로움.
도서구입 혹은 학원비 지원.
상해보험 (본인, 배우자, 자녀, 본인 부모님, 배우자 부모님)","윗사람 마음에 들기위한 보고나 스펙이 있음.
윗사람의 말이 와전되어 중간 관리자가 오버하는 경우가 있음. (야근 강요. 출퇴근 관리. 현재는 책임근무제로 많이 완화되었음)"
4,4,4,3,4,3,출근이 매우 자유로움. 기업문화가 비교적 수평적임. 꼰대알러지로 서로 꼰대짓 안하려고 눈치보는 문화. 복리후생이 끝장남. 사내에서 밥먹고 음료먹으면 돈이 저절로 모아짐. 편의점 은행 병원 보험사 다 있어서 매우매우 편리.,너무 잦은 조직개편으로인한 불안정감이 업무스트레스로 옴. 출근시간이 자유로운만큼. 퇴근시간도 매우 자유로움. 조급하고 빠르게 해결해야할 업무들이 많으므로 그만큼 업무에 대한 압박감도 큼. 알아서 혼자 잘해야하므로 신입으로 들어오면 일배우기가 힘듬.
4,4,4,3,4,4,(인턴)기업 복지가 매우 좋습니다. 대체적으러 매우 자유로운 분위기,야근이 매우 잦은듯 하고 일이 매우 많습니다. 인턴임에도 가끔 야근해야 할 일이 있을 정도
3,5,4,1,2,3,"연차를 상대적으로 자유롭게 쓸 수 있는 편, 복장이 자유로운 편, 회사 건물과 위치가 좋음, 네임밸류가 좋음, 능력이 있다면 빠른 승진과 그에 적절한 보상을 받을 수 있음","주말근무를 강요하는 분위기, 회식 많음, 야근 많음, 은근 꼰대스러움
한사람 한사람이 맡은 업무량이 엄청나게 많은 편이다."
5,3,5,4,5,4,"아침, 점심, 저녁까지 맛있는 식단, 자유 출퇴근제, 건강관리",인턴 관리에 대해서는 멘토님과의 접촉이 적어 관리가 소홀한 느낌이 듬
3,3,4,2,3,3,복지가 나름 잘 되어 있음. 연봉도 준수한 편. 한국 선두 IT기업에서 근무하고 있다는 뿌듯함,"야근이 많다, 사원들 젊은 층이 대부분이다. 그만큼 나이먹고 커리어안쌓으면 도태되기 쉬움. 경기권이라 서울에서 출퇴근하기가 힘들다"
5,4,5,4,5,4,"확실히 기업문화가 아주잘되어있습니다.
나이가 어리다고 무시받거나 그런일 전혀 없습니다.","업무량이 상당히 많은 편이지만 회사내에 문화가 너무 좋아서
그정도는 이해할 수 있습니다."
4,4,5,4,4,4,"- 만족스러운 연봉과 복지
- IT 회사중 최고라는 네임벨류
- 뛰어난 동료
- 좋은 개발환경
- 출퇴근 시간이 딱히 없는 자유로운 분위기","- 대기업이라 그런지 사용자보다는 윗사람에게 더 잘보이려는 사람들이 좀 있으며, 보수적인 사람들도 좀 있음. 그래도 일반 국내 대기업보다는 훨씬 나은 듯.
- 제품을 만들 때 말로만 사용자를 위한다고 하고 윗사람 컨펌에 더 신경쓰는 경우가 많다.
- 본사 위치가 교통이 좀 불편하고, 주차 시설이 많이 모자름."
5,4,4,4,5,3,"새로운 기술과 시스템을 도입하는건 개발자로선 도전적이지만 회사에선 보수적이기 마련. 하지만 그런 새로운 도전을 장려하는 기업중 가장 큰 기업일듯.
배울사람이 많고 책임근무제가 자기시간을 정말 유동적으로 쓸수 있게 해주는것이 큰 장점","개인주의적인 문화가 강한게 장점이자 단점. 한국식 조직문화는 다른기업대비 거의 없는편이지만 그만큼 외로움을 느낄수도 있음.
일의 편차가 부서별로 너무 큰것도 단점"
4,3,4,5,4,3,책임근무제로 팀마다 조금씩 다르지만 출퇴근이 자유로운 편임.,복지도 좋은 편이고 사내 문화도 좋기때문에 첫 직장으로는 추천하지 않음.
4,4,4,2,3,2,책임근무제와 서로의 산출물과 커리어가 오픈되어 있어서 자극받으며 근무할 수 있음,경직된 조직문화. 높으신 분의 한마디에 회사 분위기 자체가 달라지고. 일과 생활중 생활을 포기할 수 있다면 좋은 곳
3,2,3,3,3,2,"국내 최고 포탈사이트로 모르는 사람이 없음
출근 시간 자율, 복지 좋음","서비스 차원의 개발부서에 대우가 별로
부서장이 경영자들로 개발자들의 실력을 몰라줌"
5,3,5,5,5,4,"상해보험, 내부 시설 등 복지 부분에서는 단연 탑이라고 생각함.
많은 기업을 다녀본 경험은 없지만 최고였음.",개인주의가 장단점이 될수도 있다. 그리고 자주 바뀌는 정책에 직원들이 많이 흔들림 특히 외부에서 바라보는 기업 분위기와 내부의 온도차가 조금 있음.
5,2,5,3,3,5,시키는 일을 잘 하면 됨. 따로 가치를 만드는거에 신경안써도 됨,"그렇기 때문에 사람은 바보가되나, 바보가 승진기회가 더 높음"
4,3,3,4,5,3,자기계발하는 사원들이 많고 시간에 있어서 자유로운 편이다. 본인의 할일만 잘 한다면 서로의 방식을 터치하지 않는 합리적 개인주의식의 회사.,근무시간을 개인이 맘대로 정할 수 있어서 효율적인 업무를 존중하지만 업무량이 많아서 별 효과가 없다고 다들 그러신다..
3,3,3,1,3,2,시설. 비교적 수평적인 문화. 젊은 나이대의 직원들. 업계 1위. 전망이 밝다는 점.,팀에따라 다르지만.. 책임근무제라는 이름으로 출퇴근시간이 정해져있지않아 야근이 많다는것. 야근을 함에도 따로 수당이 없다는 것. IT이다 보니 개발자 중심의 분위기..? 이미지는 좋으나 다른 대기업과 분위기는 ㅂ슷. 직원교육이 없다는것. 잦은 인사변동
4,4,4,4,4,4,"복지. 근무 시간. 근무 환경.
페이도 좋은 편.
눈치 안보임","수평적인 것을 추구하나 대기업화 되어가고 있음
배우는 기회가 많지 않음"
5,3,5,4,4,4,"정말 기업을 위해서, 기업을 사랑해서 다니는 사람들이 많은 것 같다. 일을 잘해내게 되면 대우가 바뀐다. 밥이 맛있다.",말은 하지 않지만 신입에게 약 3~5명분의 일을 해낼 것이라고 기대를 하는 듯 하다. 서로 굉장히 신경을 많이 쓰고 있는 느낌을 받는다.
5,4,4,3,3,4,"인센티브 나오고 나름 안정적 버티면 됨, 연봉이 높은편",정치가 심하지만 그래도 정치 안하면 괜찮음. 찾아보면 많음 더 쓰라는데 쓸말 없음
3,3,4,3,4,3,일단 업계 최고란 네임밸류. 복지가 좋고 구성원들이 실력있는 사람들이라 배울것이 많음.,치열하다. 다들 자기 업무 처리하기에 바쁨. 정말 열심히 해야 살아남을 수 있음. 잦은 인사이동
5,4,4,4,4,4,자유로운 분위기이며 복지가 좋아요 건물이 이뻐요 인지도 최고의 회사인것 같습니다,"경기도에 있어서 서울이 집인 사람은 출퇴근이 힘듬
야근이 종종 있습니다."
5,4,5,3,4,4,"출퇴근이 눈치 안보고 자유로운 편이며, 일의 업무 강도에 따라 유연한 근무가 가능한 점. 실력있는 동료와 상사를 배우며 일할 수 있다. 개인이 능력에 따라 일을 분배하여 일할 수 있으며, 서로의 작업과 커리어가 오픈되어 있어서 자극을 받을 수 있음.","실력 위주의 회사라 열심히 자신의 일을 즐기려고 노력하여 커리어를 쌓지 않으면 살아 남기 힘들 거라 느껴짐. 잦은 인사이동, 그래서 끈끈한 인간관계를 맺어야 한다는 생각이 들지 않아서 아쉬운 점도 있음. 책임감이 필수라 자신의 일에 대해 부담이라면 부담을 가지고 열심히 일해야함."
3,3,3,3,3,3,"남들이 부러워함
젊음
구내식당 맛잇음
사내연애 은근 많음","연봉 생각보다 낮음
사내정치 ㅋ 어마어마 ㅋ
편먹기 라인타기 쩜"
4,4,3,3,4,4,우리나라 최고의 개발터이다. 평생 공부하면서 일하고 싶은 사람에게 추천함.,부서마다 업무강도가 차이가 심함. 또 신입이지만 알아서 공부해야하는 경우가 많음
4,3,4,3,3,2,승진 욕심 없이 정말 자기 중심적으로 일한다면 정말 편하게 일할수도 있음. 부서마다 많이 다르겠지만.,부서가 갑자기 신설되거나 갑자기 사라지거나 하는 등 대기업이지만 아직까지도 자리가 잡혀 있지 않는 느낌이 큼
3,3,4,2,3,2,"급여수준, 복지수준, 업무환경 등 다들 아는대로 좋음. 다만 복리나 업무환경이 외부이미지대로 자유롭다고만 생각하면 안됨. 분위기에 따라 다를수있음.",조직이동이나 부서변경 등이 잦음. 서비스 출시 종료 등에 따라 잦은 이동이 동반됨. 부서별로 업무강도 등이 다르므로 지원직군에 따라 많이 다름.
2,3,4,1,3,1,복지 좋음. 자유로운 분위기 믿지말것. 카페테리아 홍보해놓고 출입시간 체크해서 조진적있음.,체계 없다가 만들려고 하니 급 경직화. 부서이동 많음.
5,4,4,4,5,4,"최고의 사옥, 안정적인 현금 흐름, 자유로운 문화(자율출퇴근, 수평 호칭), 괜찮은 연봉과 복지, 유능한 팀원, Labs를 중심으로 한 양질의 기술 문화 형성 등 뭐하나 빼놓을 곳이 없는 완성된 회사",서스 업무 맡으면 지루할 수 있다. 이미 국내 매출은 천장을 찍어서 올라갈 곳이 없는 느낌이 있다. 라인 플랫폼을 타고 해외로 눈을 돌리고 있다.
3,3,3,2,2,1,동종업계1위로 자유로운 분위기 사업부서는 자율출근제를 도입하여 자유롭게 출퇴근,체계없음 부서간 연봉차이사 크며 회사가 사업을 모두 잘 관리하고 있다는 느낌이 없음
4,4,4,3,5,4,"연차를 눈치 안보고 쓸수있으며
부서에 따라 자율출퇴근도 잘 시행되기도 한다
전반적으로 자유로운 분위기","야근이 많은편이며
야근률을 평가에 많이 반영
윗분들이 아무일도 안하고 성과를 챙길수 있는 구조"
4,3,5,4,5,3,"자율 출퇴근, 책임 근무제
서로를 존중하며 호칭을 이름+님으로만 부르는 문화
사람들이 여유가 있고 말랑말랑한 사고를 가질 수 있도록 환경을 제공","연봉을 성과제로 측정하는게 강해서 부서나 업무 운이 좋아야함..
열심히한 과정보다는 결과를 위주로 보상이 돌아가는 경향이 있는 것 같았다."
3,3,4,3,2,2,복리후생을 비롯해서 대기업 준하는 곳이 카카오를 비롯해 몇 군데나 있을까. 분명한 장점은 맞음,"제품 개발에 1,2년 걸리고 실제 내부 의사결정은 모두 topdown이라 혁신성을 기대할 것이라면, 게다가 라인 빼고는 모바일 환경에 맞는 제품 중 끌만한 게 몇 개나 이제 될까"
4,4,4,2,3,4,업계 최고의 인재들과 교류하며 실력을 키우기에는 최적의 회사,"만성화된 야근 및 철야, 생각보다 보수적인 조직 문화, 개발직과 비개발직 간 보상 차이 상당"
4,4,4,4,4,4,"자유출근제, 수평적 문화, 자부심을 가지고 일할 수 있음",지하철역에서 멀고 분당에 위치함. 신입이 바로 갈 수 있는 루트가 적음(스텝제외)
3,4,4,2,2,2,사옥이 시설이 좋고 복장 자유롭고 어린이집도 있고 여러 직원을 위한 복지가 잘되있다,체계가 없는 부분이 많고 은근히 군대식 기업문화.. (부서마다 다를 수도 있다)
3,3,4,2,3,1,"남들이 부러워하는
자유로워보이는
멋진빌딩외관
업계중에선 그나마
나름 수평적","예전만치는 아님
실력자들이 카카오로 많이감
공뭔같은 사람들있음
갑마인드
경쟁심화 치열함강조"
5,4,5,4,4,4,"대기업에 비해 수평적이며, 조직 내 커뮤니케이션이 잘 돼 있음","벤처에 비해 의사결정 과정이 복잡하며, 점점 과감한 시도보다는 수성에 신경쓰는 모습"
4,3,4,4,3,4,국내 1위 포털을 서비스한다는데서 오는 자부심. 비교적 수평적인 회사 분위기. 책임근무제를 통한 유연한 근무. 국내의 실력있는 사람들과 일한다는 것. 회사에서 지언 받아 싼 식비. 에듀코인을 통한 자기계발.,자유를 주는 만큼 책임이 따름. 돈 주는 만큼 일을 시키는 듯. 생각보다는 체계가 잡히지 않은 업무 프로세스. 외부적으론 여러 제도를 통한 자유로운 사내문화를 자랑하지만 꼭 그렇지만은 않음. 대기업스으러운 면이 없지않아 있음
3,1,4,1,2,1,"복지 하나는 정말 끝내줌. 돈도 잘 벌고, 해외 사업도 아직까지는 잘 되고 있어, 당장 망하지 않고 월급은 꼬박꼬박 나옴.","너무 빡셈. 경쟁경쟁경쟁, 실적실적실적. 개인적인 비전은 별로 없음. 젊은 사원은 적게 뽑고, 한번 뽑아 놓은 사람들은 나가지 않다보니, 고만고만한 나이가 많이 몰려 있는 역삼각형 구조라, 승진은 어렵다고 봐야 함."
4,3,4,3,4,3,체계가 잘 잡혀있고 책임근무제 도입으로 근무환경도 더 좋아짐. 건물 및 사내시설 매우 좋으며 지하식당 밥도 잘 나옴.,"성과위주로 업무가 빡쎄고 심적인 스트레스가 있다.
조직개편이 잦고 인사제도 등이 계속 바뀌면서 투명하지 않은듯."
2,3,4,1,2,2,부동의 1위기업으로 IT업계에서 가장 탄탄한 시총 10위내외의 향후 5년간을 절대 안망할 회사.,능력과 상관없이 버티고 오래다니면 의리로 뭔가 나오기는 함. 입사와 퇴사 순서가 반대임. 오래다닐 생각으로 이직했다가 가장 먼저 퇴사할 수 있음
5,3,4,4,5,4,책임근무제가 가능해서 근태관리가 매우 타이트 하진 않음. 다만 조직에 따라 엄청나게 일이 몰려 와서 휴가를 쓰고 싶어도 일 때문에 못쓰는 조직도 있으니 참고. 직원들이 대부분 스마트함. 물론 예외도 있으니 조심. 복리후생은 대부분 다 알려져 있으니 생략.,"호칭 통일이라 '님'이나 '매니져'로 호칭해야 하는 조직이 많음. 승진이 블랙박스화 되어 직장인의 로망인 연봉, 승진 중에 하나가 거의 의미 없어짐."
4,2,3,2,4,3,자유로운 분위기 및 기본적인 상호 존중을 기반으로 한 소통. 팀바이 팀일수 있음,"아이티 업계 다운 근무 강도, 저녁이 없는 삶을 제공해주는 환경"
3,2,2,1,3,3,"자기 할 일만 다 한다면 연차, 출퇴근에 대해 간섭이 별로 없음.",부서에 따라서 성취감 차이가 정말 심함. 부서에 따라서 방치되고 있다는 느낌을 받기 쉬움.
3,3,4,2,3,2,"업계 내 최고 수준의 복지 혜택을 받을 수 있음.
매우 자유로운 업무 분위기","점점 대기업화 되어가는 분위기이지만, 그만큼 체계적이지 못함.
개인 성과 달성을 위한 견제가 심한 편임.
부서별 분위기가 매우 다름."
4,4,5,5,4,3,"복지가 잘되어있어, 삶과 일의 균형을 맞추며 일 할 수 있다.",근무 탄력제라고는 하지만 회사 분위기상 마음대로 쓸 수가 없다.
4,3,4,4,4,4,"복지 면에서는 업계 탑이라고 해도 과언이 아닐듯. 출퇴근 셔틀에 조식 제공, 싸고 맛있는 점심, 까페와 각종 편의시설 등.. 문화도 서로 님자 부르고 등등 전형적인 좋은 IT회사의 문화.","S사, L사 등과 비교할 수준은 아니지만 어쨌든 대기업은 대기업. 본인 스스로 맡게 될 업무의 영역은 좁을 확률이 꽤 있다. 새롭고 챌린징한 업무를 맡기는 힘들수도."
5,3,5,2,5,4,출퇴근시간이 없어서 지각이란 개념이없다. 상사가 야근해도 눈치안보고 퇴근할수있다. 다른사람한텐 신경도안쓴다. 연봉이 생각보다안많다는 평이있었는데 알려진것보다 훨씬많이받는다. s전자나 h자동차처럼 기형적으로 높은연봉주는 회사제외하면 최고수준,셔틀버스가 없어져서 출퇴근이 힘들다. 바쁜 기간에는 야근을 매일할수도 있다.
4,4,4,2,4,4,"복지는 정말 최고. 직원들이 본업 이외에는 신경쓰지 않아도 될만큼 모든면에서 케어받을 수 있는 회사. 사내직원들이 젊고 복장도 자유롭다보니 딱딱한 회사가 아니라 수평적이고 재미있게
일할 수 있는 회사였음. 또한 서로 치열하게 경쟁하고 그만큼 보상을 해주니 한 때 젊은 열정으로 치열하게 일해볼 수 있는 회사.","현재 분위기는 어떻게 변했을지 모르겠지만 벤처에서 시작했기 때문에 헝그리정신과 야근, 회사에 올인해야하는 정신상태를 강압받을 수도 있음. 이제 몸집이 커져서 완벽하게 수평적 조직구조는 아닌데 또 대기업의 복잡한 결재라인도 가지고 있음. 직원 평가 성과 평가가 상대적 박탈감을 느끼게 할때도 있음."
5,4,5,4,5,3,책임근무제를 시행하여 출퇴근 시간 부담이 적다. 물론 책임이라는 단어가 붙는 만큼 본인이 책임을 다해야 한다.,대기업문화가 정착해서 의사결정이나 업무 추진속도가 그리 빠르지는 않다.
4,3,4,2,4,3,국내 최고의 인재들이 모여있는 만큼 업무 진행시 다방면으로 전문가와 협력할 수 있고 많은 노하우를 배울 수 있음,과도한 경쟁과 업무로 야근이 많아서 라이프앤워크 발랜스를 유지하기 힘듬
5,5,5,3,4,3,복지가 최고이며 인센티브가 나온다. 자유로운 분위기가 좋다.,야근은 있는편이고 급하게 처리해야 할 일이 많다. 몇 년째 치열을 너무 강조하다 보니 만성화되어 그러려니 하기 된다.
4,4,4,2,4,3,사업기반 안정적. 아이티업종 최대 네임밸류와 복지 보상.자유복장과 자율근무제. 일반대기업보단 자유로운 분위기와 약간수평적 위계질서. 인성좋은 직원이 타기업보다 많음. 멋진건물. 똑똑한 직원들도 많이있음,"위 장점이 점점 줄어드는분위기. 보고문화와 정치라인. 심한 경쟁과 겉으로는 친한듯하지만 속으로는 시기질투 심함.
대기업화되며 그에따른 병폐수반. 자유로운 젊은 직원들이 많이퇴사하고 부차장급들 비중이 늘어나며 평균연령이 계속 증가."
3,3,3,1,3,2,10시 출근. 부서에 따라서는 자율출퇴근 제도 활용 가능. 복장 자유. 육아휴직제도를 자유롭게 활용하는 분위기. 복지도 괜찮은 편.,"분당에 위치하고 있어 서울 접근성 떨어짐. 개발,디자인,기획을 중심으로 돌아가는 회사라 관리직은 소외되는 분위기."
4,4,5,3,4,3,업계1위의자부심 및 복지가잘되어있고 남녀차별이거의없음.,경쟁이점점심화되고 40대즈음팀장이못되면 무시당하는느낌이있음
4,4,5,4,4,4,"생각하는 것 이상의 뛰어난 복지 시스템을 가지고 있으며, 뛰어난 동료들이 많이 있기 때문에, 배울 것이 산더미 같음.","경쟁이 심하고, 업무 강도가 높으며, 업무 방식이 기존 대기업들과 비슷하다고 볼 수 있음."
3,3,4,4,4,2,"자유로운 분위기. 자기 일만 잘 하면 심하게 터치하는 경우는 없으며, 회식도 빡세게 하지는 않음",조직개편이 수시로 일어나 일이 익숙해진다 싶으면 팀 업무가 바뀌는 경우가 힘들다
4,3,4,2,3,3,직원들을 위한 다양한 복지 시설을 갖추고있다. 출근시간이 비교적 자유롭다.,"다양한 복지시설(택배업무, 병원 등..)을 갖추고 있는데에는 다 그럴만한 이유가 있습니다...
밖에서 생각하는것만큼 매우 자유분방한 분위기는 아니다."
4,3,5,3,4,4,"개개인의 능력이 다들 뛰어남.
대부분의 윗사람들은 그 위치에 있는 이유가 있음.
개발자 대우도 괜찮고 대부분의 기획자가 상생 마인드 있음",높은 수준의 코드를 짜는 사람보단 중간 레벨의 코드를 빨리 짜는 사람을 좋아함. 코드 퀄리티에 관심 많으면 피하는걸 추천.
4,3,4,2,4,3,인프라가 잘 되어있다. 사옥도 좋고 복지도 좋고 외부적으로 바라보았을때 장점이 매우 많다. 연봉도 만족스러운편,창의적인 것을 해야하는 만큼 개인시간이나 여러가지를 경험할 시간이 필요하지만 업무양이 매우 많아 그점은 불가하다.
3,3,3,3,3,3,"복지가 좋음
부서에따라 다르지만 연차를 유동적으로 사용할 수 있음
사내인프라가 좋음 위치도 좋고 사내도서관이 잘되어있음
초봉도 적지않은 수준 자유로운 복장","정직원이 해야할 일을 기자단이나 파트타이머 알바에게 넘기는 경향이 있음
초봉은 적지 않으나 연봉인상률이 낮음
프로젝트성 업무가 많아 업무애착도가 떨어짐"
4,3,5,4,4,3,개발 역량을 높일 수 있다. 회사가 안정적이다. 복지가 좋은 편이다.,도전적인 일이 많지 않다. 서비스 유지 관리 업무가 상대적으로 많은 편이다.
