star,promotion,welfare,worklife,culture,ceo,merit,disadvantage
5,5,4,5,5,5,"1. 야근을 기피하는 문화

2. 인센티브제가 아닌 공동 성과 시스템은 책임 전가 문화 또는 성과 가로채기 를 없게 해줌","1. 생긴지 얼마 안 되어 시스템이나 조직 체계가 다소 미흡함

2. 직급이 없기 때문에 처음에 적응하기가 살짝 어색하고 어려움

3."
5,4,5,4,5,5,스타트업 업계에서 가장 빠르게 성장하는 회사 중 하나입니다. 님 자를 쓰는 수평적인 분위기 정말 좋고요 자신의 성장을 제일 중요한 가치로 생각하는 회사입니다,장점일수도 있고 단점일 수도 있는데 각자에게 권한이 확실하게 주어지는데 이를 뒷받침하는 교육은 부족하며 개인이 맞춰서 성장해야 합니다.
4,5,4,4,5,5,"직급 체계 자체가 없고, 상호 평등한 관계로 일할 수 있다. 젊은 사람들로 이뤄진 기업이라 일명 꼰대가 없어서 일하기 편하다.",대기업이랑 비교하면 월급은 짜다. 그리고 설이나 추석 때 빠방한 상여금도 없음. 상품권크리..
5,3,5,5,5,5,의사결정 과정에서 구성원의 의견을 최대한 반영하고자 노력,성장에 따른 프로세스가 아직 완벽하게 갖추어지지는 않은 상태
2,2,2,5,3,3,1위 기업의 자부심을 느낄 수 있습니다. 스타트업 답지 않은 스타트업!,아직 체계를 잡아나가는 단계여서 그런지 비효율/비합리적인 부분이 있습니다
5,4,4,5,5,4,"사원들의 복지가 잘 제공된다, 사무실내에 나오는 음악은 업무 환경에 큰 도움이 된다. 회사내에 인테리어 매우 좋다. 전반적으로 일하기 좋은 분위기다.","거의 없다고 생각,
회사의 직급 체계가 확실하지않아 호칭의 불편함이 있었지만 적응이 빠르게됨"
4,4,4,3,4,5,여러종류의 음료수와 커피를 마음껏 먹을 수 있으며 회사 분위기 또한 항상 밝고 에너지가 넘칩니다.,업무 특성상 이례적인 일과 변경되는 사항들이 많아서 항상 수시로 체크를 해야합니다.
4,4,2,4,3,4,기업의 성장과 함께 나 자신도 동반성장을 느낄수 있는 현재 진행형 회사,비교적 단기간에 성장을 한 회사이기 때문에 인사 및 내부 시스템이 체계적이지 못한 느낌
5,4,4,4,5,5,편안한 업무 환경에서 모두 즐겁게 일할수있어서 좋아요. 벤처회사라 의사반영도 잘되고 변화가 많아 재미있습니다.,타부서와의 소통에 문제가 있는거 같아요. 협력이 잘안되는................
5,4,4,5,4,4,탄력적이라는 말을 많이 들어보셨겠지만 이곳은 절대 노노 본인이 해나가는 거에서 스스로 찾아서 할수있는 분위기 이기때문에 일을 함에있어 즐겁습니다 그리고 어느회사보다 빠르게 성장해나가기 때문에 더 열정을 느끼며 일할수 있고 회사후 봄인 자기개발을 위해 교육비도 지원해주는거에대해서 짱짱맨,서열 계급 이란게 없기때문에 그런곳에 익숙하신분들은 의아해 하실수도 있다???
5,5,4,5,5,5,"꼰대 문화 없습니다. 대표님도 신입사원에게 고개 숙여 인사하는 곳
야근 지양 문화로 일과 삶의 밸런스를 충족시킬 수 있음
눈치 야근, 눈치 퇴근 없습니다.
회사를 수단으로 생각하며 자기 자신의 성장을 위할 수 있는 곳.
무료 음료와 커피
일하다가 청계천가서 머리식힐 수 있는 배려있는 곳.
좋은 사람들, 기본적으로 가장 중요한 인간관계를 좋은 사람들과
함께할 수 있는 곳.
레슨비 체력단련비 지급
업계에서 인정받는 최초,최대,최고의 스타트업","일 잘해야 합니다. 대세에 편승해가려는 스타일인 분들께는 어울리지 않는 곳.
기본적으로 스타트업은 프로들이 모여 하나의 목표에 집중하는 곳이라 뒤쳐지거나 도태되면 불안할 수도 있어요.
동호회 등 팀끼리 상호 소통할 수 있는 기회가 적어 아쉽습니다."
4,4,3,4,4,4,"수평적 분위기, 젊고 생동감 넘치는 회사. 동기부여기되는 회사 분위기.","아직 투자를 받고 있는 상황이고, 지속적인 수익구조가 필요한 상황이다."
5,5,4,5,5,5,"부동산 업계 1위, 다운로드 천만 앱, 젊은 구성원들의 꿈터, 여유있는 출근시간과 저녁이 있는 퇴근시간",늘어나는 구성원들로 인해 언젠가는 사무실이 좁아질 수도 있겠다는 걱정
4,5,2,4,4,5,"수평적인 분위기, 쾌적한 사무공간, 교통이 편리함,배울 점이 많음, 야근이 거의 없음, 회사의 룰만 잘 따른다면 개개인의 성과에 연연하지 않아도 됨, 소수의 의견도 존중 받을 수 있음","개개인의 공백이 커서 자리를 비우기가 쉽지 않음, 업무환경(제도적/시스템적 측면)의 안정성이 더 필요함"
2,4,2,1,2,2,"1. 교육기간이 짧아 실전배치가 빠르다(신규도 뽑지만 대부분 경력이 있거나 요구됨)
2. 워크앤라이프 밸런스 중요시
3. 술 강요 회식문화 지양
4. 수평적인 기업문화 및 상호존칭","1. 부서 간 커뮤니케이션이 부족 한 편이고, 전사차원으로 부서간 교류 할 수 있는 기회가 적다
2. 복지적은 대기업 분위기"
5,4,4,5,5,5,직원들에게 회시비젼 뿐만 아니라 자신 스스로도 비전을 가지고 무언가 얻어가길 바라고 지원해주는 그런곳.,기존의 전통적인 기업문화나 계급적인 구조를 원하신다면 전혀 어울리는 회사가 아닙니다.
4,3,5,5,5,4,"빠르게 성장하는 회사, 조직이 크지 않아 돌아가는 과정을 직접 보고 느낄 수 있음",아직 체계가 잡히는 단계라 다소 업무 관련 혼란이 있음
5,5,4,5,5,5,"수평적인 사내 분위기/처음 일을 시작할 때 체계적인 교육이 있어 좋았다./열심히 일하고 배우며 성장할 수 있는 곳이다./야근은 거의 없다고 봐야 하며 근무시간 내 효율적으로 일하는 문화이다./음료 무한 제공, 업무 관련 도서 비지원, 레슨비 지원, 체력단련비 지원, 리프레시 휴가 등의 혜택있다.",여러 사람의 다양성을 지나치게 존중해주는 것 같다. 회사가 빠르게 성장하고 직원 수도 빠르게 늘어나는 상황에서 어느 정도 다양성의 파괴가 필요할 것 같고 다양성의 파괴가 창의성을 파괴하는 건 아니라고 생각한다.
5,4,3,5,4,4,"뭐를 배우든지 10만원씩 레슨비를 주고, 헬스장 등록하면 체력단련비로 지원. 일상생활에서 이런 개인 활동이 가능하도록 야근을 자연스럽게 강요하는 분위기가 없음",빠르게 성장하다보니 이제 모르는 사람들이 슬슬 많아져서 조직 내 체계적인 커뮤니케이션 시스템이 필요해지는 상황
5,4,4,5,4,4,"스타트업이지만 질서가 있는 점, 빠른 의사결정구조, 야근 강요가 없고 자기계발시간을 장려하는 점, 대표가 1:1로 직원들과 소통하려고 노력하는 점, 직원들간 소통을 적극적으로 지원",아직까지 복리후생 등이 다양하지 못함. 이 부분은 구성원간 의견을 반영하여 개선 노력하는 듯 보임
4,3,4,5,4,3,"1년마다 주어지는 리프레쉬 휴가 혜택, 회사의 성장에 따른 직원 보상, 계속 빠르게 성장하는 회사의 일원으로서 자부심",꾸준한 성장과 변화의 과정에서 생기는 프로세스 미정립
5,4,4,5,5,5,'주'문화를 다루기에 주목받는 성장기업인 만큼 발전가능성이 높다는 점. 수직적이지 않은 조직관계 및 분위기가 일할 때의 원동력이 됨.,"신입보다 경력자들이 많아, 아직까지 체계화된 연수체제는 없다는 점. 스스로 열심히 습득해나가는 묘미."
5,5,5,5,5,5,대한민국 1등 부동산 광고서비스 채널브리즈(주)는 자유로운 분위기 & 수평적 관계에서 편안하게 근무 가능합니다. 벤처회사 답게 변화가 많아 하루하루 새롭습니다.,모험심이 약하고 변화에 적응을 못하시면 힘들수 있습니다. 일하려는 의지만 있으시면 극복 가능합니다.
5,4,4,5,5,5,"수평적인 문화, 다양한 복지, 야근 지양 문화, 젊은 층이 많아서 재미있게 일할 수 있다",큰 단점이라고는 없지만 건물 자체에 흡연구역이 좁아서 흡연자들은 일부 불편할 수 있음
5,3,3,4,3,3,"부동산 정보 1위 회사에 다니는 자부심과 회사의 위치가 좋다.
리프레쉬라는 휴가제도 등 복지가 좋다.",외부에서 주목받는 만큼 더 잘해야 된다는 부담감이 있다.
4,4,3,4,3,3,"현실적 비전 제시, 이성적 복지 제공, 적정 수준의 보상, 균형적 삶 등을 지향함","하향식 의사 결정 구조, 이미 결정된 사항들이 맘에 안 든다면 떠나는 것이 회사와 본인 서로에게 나음"
3,3,3,3,4,3,벤처 기업 사이에서는 괜찮은 복지와 급여 수준을 가지고 있음. 업무 강도는 적정하다. 젊은 분위기의 사내문화로 자유롭고 제약이 없는 편이다. 기업의 성장성도 있고 비전 또한 확실한 편이다.,"벤처기업이지만 능력껏 재량껏 일을 할 수 있다기 보다는, 시키는 일을 해야한다. 업무 분야(영업)가 전문성이 없기 때문에 중간에 나오거나 회사에 문제가 생기면 이도저도 아니게 된다."
